text,date,label,label_name,id
{{USERNAME}} should hire Anthony Weiner to discuss David Pecker’s testimony. 		ROFL! 🍆🍆😂💦 {{URL}},2024-04-26,8,prophesy,1783908856239718881
{{USERNAME}} And this is as real as a testimony can get because you've seen me in real life!!,2024-04-26,8,prophesy,1783908847393890453
Bombshell testimony on Trudeau-NDP hard drug policies. #Trudeauing is bad for Canada {{URL}} via {{USERNAME}},2024-04-26,8,prophesy,1783908819103310243
"Now regarding the issue of the Hadith you quoted, about a fight between Jews and Muslims at the end of time, where a tree will say ""a jew is behind me come and kill him"", this is a prophesy agreed upon by both Muslims and Jew... and Jews themselves have similar prophecies",2024-04-26,8,prophesy,1783908809389289619
{{USERNAME}} {{USERNAME}} {{USERNAME}} {{USERNAME}} Hide a sexual relationship? Lol	You haven't a clue what's going on. That's not what the case is. Good lord you're ignorant.	Did you miss the testimony from Pecker? You might want to start paying attention to what's going on because right now you sound vaccinated,2024-04-26,8,prophesy,1783908777902649652
Testimony 😁 tomorrow @ it again cont wait 💪🏼🇿🇦🏳️‍🌈🍆💦 {{URL}},2024-04-26,8,prophesy,1783908756545278252
"{{USERNAME}} {{USERNAME}} {{USERNAME}} {{USERNAME}} {{USERNAME}} {{USERNAME}} {{USERNAME}} {{USERNAME}} {{USERNAME}} Angela was v composed in her testimony ""despite everything"" u might say	will Paula be different do u think?",2024-04-26,8,prophesy,1783908756000043364
"In other words,	just your typical dishonest, violent democrat operative.		Judge Cannon Unseals Docs	Alleging Jack Smith's Lead Prosecutor	Threatened Trump Valet Attorney	and Tried to Bribe Him in Exchange	For Client's Testimony Against Trump {{URL}}",2024-04-26,8,prophesy,1783908747951350101
{{USERNAME}} Problem isn’t the testimony. Trump’s problem is the courtroom venue. Do you really think he’ll get a non-biased jury.,2024-04-26,8,prophesy,1783908734336455144
Treat students， more praise and encouragement， less criticism and criticism。 		MILE FOR GUERLAIN UNVEIL  #MilexGuerlainTH  #MilePhakphum,2024-04-26,8,prophesy,1783908683099021655
where is that khun pond??! I need encouragement love to edit🙇‍♀️,2024-04-26,8,prophesy,1783908656305868977
"Our May 3rd hearing will provide a platform for expert testimony on the implications of the gray wolf surge, including its economic, ecological, and societal ramifications, and how we address this pressing issue going forward.	{{URL}}",2024-04-26,8,prophesy,1783908649972470092
{{USERNAME}} It’s about sharing your testimony with others. Great time to invite your friends to church and share the gospel. It also encourages and invigorates believers around you. It’s a public declaration of what’s has occurred within you.		Baptism doesn’t save or change you.,2024-04-26,8,prophesy,1783908637380845686
{{USERNAME}} Thank you Lord for our sisters testimony and thank you Lord for the life of Brother Chris his wife Evangelist Allison and his entire team. Lord empower him to do more and use his faculties more in Jesus Christ name Amen,2024-04-26,8,prophesy,1783908604862472658
Pecker challenged on inconsistency in testimony....		Oops,2024-04-26,8,prophesy,1783908561640104316
"{{USERNAME}} {{USERNAME}} Only if the statements are in conflict. The fact that his testimony conflicts with FBI reports causes him to appear unreliable. But, that is minor when everything is years apart.",2024-04-26,8,prophesy,1783908542132465802
{{USERNAME}} Have you been keeping up with David Pecker's testimony in Trump's Election Interference trial? Trump definitely stole the 2016 election with help. Our country could be in a much better place now. That criminal should be in prison.,2024-04-26,8,prophesy,1783908541725626642
Rise Above Discouragement: Let the Lord Guide You #Faith #Encouragement #TrustInGod #lord #Jesus		{{URL}} via {{USERNAME}} {{URL}},2024-04-26,8,prophesy,1783908495223402588
{{USERNAME}} {{USERNAME}} Will {{USERNAME}} testimony be today’s birthday present for {{USERNAME}} from {{USERNAME}}  ? {{URL}},2024-04-26,8,prophesy,1783908474935775400
Developing: David Pecker’s Testimony Destroys Prosecution’s Case Against Trump		He testified that Trump “had no idea what [he] was talking about” when he asked about reimbursing Michael Cohen for the Stormy payment		{{URL}},2024-04-26,8,prophesy,1783908473207660885
{{USERNAME}} The tape is definitely a good sell on what he’s capable of. Sometimes we as scouts (myself included) get more hung up on the percentages than the context. Quinn is a very talented lead guard prospect,2024-04-26,8,prophesy,1783908432824733940
{{USERNAME}} Congratulations sir. I dined that day in Abuja too. Thank you for your words of encouragement.,2024-04-26,8,prophesy,1783908429846765770
{{USERNAME}} Will {{USERNAME}} testimony be today’s birthday present for {{USERNAME}} from {{USERNAME}}  ? {{URL}},2024-04-26,8,prophesy,1783908425245794504
{{USERNAME}} I am Speechless ❤️❤️ I am Beyond Grateful for your thoughtfulness and encouragement 💕,2024-04-26,8,prophesy,1783908402780864725
{{USERNAME}} Will {{USERNAME}} testimony be today’s birthday present for {{USERNAME}} from {{USERNAME}}  ? {{URL}},2024-04-26,8,prophesy,1783908393088126980
Thank you ASG {{USERNAME}} for the words of encouragement &amp; support. 		The impact of climate change affects the poor disproportionatly. Women and young children bear the brunt of displacement and suffering. 		We must prioritise mobilisation of #climatefinance for #Adaptation {{URL}},2024-04-26,8,prophesy,1783908364470169932
"ICYMI - For #EarthDay, CBS interviewed JAMES BALOG, 📷🌎environmental photographer &amp; INSTAAR Affiliate. He shares that his photos are his testimony, a record of our past &amp; present, &amp; a message for the future. 1200 of his prints were acquired by {{USERNAME}}! Congrats James 🥳 {{URL}}",2024-04-26,8,prophesy,1783908310288056334
{{USERNAME}} {{USERNAME}} speaking truth and talking God's prophesy plans threatens their lies and highlights their evil schemes,2024-04-26,8,prophesy,1783910925764100437
"People need to understand… January 6, 2021 THE RESIDENT PRESIDENT on that very day was NOT trying to OVERTURN THE ELECTION. He was stating that the election was a fraud. This has turned out to be fact; supported by video and testimony. Propaganda and ignorance are no excuse.",2024-04-26,8,prophesy,1783911515814244514
{{USERNAME}} I don't understand how right wingers expect her to be in court supporting this j{{USERNAME}}. So she can basically hear testimony from 2 of his mistresses? That's just cruel on so many levels.,2024-04-26,8,prophesy,1783911466237571583
David Pecker provided testimony to a New York jury as prosecutors allege that Trump falsified business records in a scheme to influence the 2016 election. {{URL}},2024-04-26,8,prophesy,1783911451972776288
"Without the encouragement of the United States, Israel would never dare to commit a terrible genocide against Palestine. {{URL}}",2024-04-26,8,prophesy,1783911445371228227
"{{USERNAME}} This testimony underlines the lengths to which individuals went to manipulate electoral outcomes. Pecker's admission adds a concrete example of such tactics, potentially carrying significant implications for understanding the extent of influence and corruption in the 2016… {{URL}}",2024-04-26,8,prophesy,1783911436500058175
Trump’s lawyers seek to discredit testimony of prosecution’s lead witness in hush money trial {{URL}},2024-04-26,8,prophesy,1783911434289651896
"Won't be able to shake off the testimony of a cop during OJ Simpson trial, how he narrated he was drenched in the blood of a black person whom he attacked senseless during the 60's civil rights movement",2024-04-26,8,prophesy,1783911433266221408
Now I’m inclined to believe that woman gave false testimony because how can you claim you studied law and you’re now acting like a thief?,2024-04-26,8,prophesy,1783911405336301850
Developing: David Pecker's Testimony Destroys Prosecution's Case Against Trump {{URL}} #gatewaypundit via {{USERNAME}},2024-04-26,8,prophesy,1783911377142190362
{{USERNAME}} What he means is that a woman's testimony alone especially when it doesn't line up with her actions should not be enough to imprison a man.	This truly is a victory for all men regardless of how disgusting Harvey is.,2024-04-26,8,prophesy,1783911364710330749
{{USERNAME}} Give me ur testimony at the end of the day when it does!!!,2024-04-26,8,prophesy,1783911339293085782
I'm a bit shocked that #TeamTrump has not hired ret hat actors from Crraig's list to dot the entrance with signs. 		T rump whines court being kept 'very cold on purpose' as day 4 of Pecker testimony begins {{URL}},2024-04-26,8,prophesy,1783911140935754062
{{USERNAME}} You've always been so kind and I appreciate your generosity and encouragement. Thank you!,2024-04-26,8,prophesy,1783911118982861245
{{USERNAME}} nevertheless it financial proposed remaining testimony,2024-04-26,8,prophesy,1783911043439403512
{{USERNAME}} {{USERNAME}} SHOs demand bribes if we ask progress of FIRs lodged in Hyd. They take bribes from accused. SHOs reply to top officials that no one came to give evidence or testimony. Are they post boxes? Read books to appear in exam. Read complain letter to bust crime. If police demand bribes?,2024-04-26,8,prophesy,1783911017724187105
{{USERNAME}} Still in my darkest moment. I pray I pull out before it's too late so that I can give testimony on here by the grace of God.🙏🏽,2024-04-26,8,prophesy,1783912146734063969
Donald Trump's defense team in his hush money case sought Friday to undermine the testimony of the prosecution's lead witness and his account that a tabloid's practice of helping to bury embarrassing stories about Trump was part of a scheme to aid the R... {{URL}},2024-04-26,8,prophesy,1783911997311992217
{{USERNAME}} “ Trump at hush money trial wishes Melania ‘happy birthday’ as testimony about trysts continue “ - {{URL}} 4/26/24.		Typical Trump buffoonery.,2024-04-26,8,prophesy,1783911990869856505
"In redirect, prosecutors will bring Pecker's testimony to a climax. {{URL}}",2024-04-26,8,prophesy,1783911974998323260
"Blowin' smoke up at the Heaven, count my blessings, tryna find atonement. My life's a testimony, that's why I stay high and holy",2024-04-26,8,prophesy,1783911971466649671
"Donald Trump 'Absolutely Dreading' the Testimony of Karen McDougal in Hush Money Trial, Claims Attorney #NewsBreak {{URL}}",2024-04-26,8,prophesy,1783911955293426026
““People are in pain upon pain and siege upon siege.” A testimony from a Moroccan doctor about the horrific situation in Strip #غزة as a result of the Israeli war. {{URL}},2024-04-26,8,prophesy,1783911948930666870
{{USERNAME}} {{USERNAME}} {{USERNAME}} Oh noes!! He waited for an hour - no one is perfect.	Did you see the recent testimony that Trump ordered National Guard before 1/6 AND that LE response was deliberately slow walked by command to ensure as much chaos as possible for POLITICAL optics...	#Fedsurrection,2024-04-26,8,prophesy,1783911948872045024
David Pecker provided testimony to a New York jury as prosecutors allege that Trump falsified business records in a scheme to influence the 2016 election. {{URL}},2024-04-26,8,prophesy,1783911932187009210
"{{USERNAME}} Here is sworn testimony from CAPITOL POLICE who were BRUTALLY ATTACKED by Trump supporters on Jan. 6th.		149 Capitol police were INJURED. 4 COMMITTED SUICIDE.		Over 1,000 Trump supporters are now CONVICTED FELONS. 10 were convicted of SEDITIOUS CONSPIRACY.	{{URL}}",2024-04-26,8,prophesy,1783911915569234158
{{USERNAME}} {{USERNAME}} {{USERNAME}} {{USERNAME}} {{USERNAME}} {{USERNAME}} Listen to the Formal Hamas prisoner and their testimony 		{{URL}},2024-04-26,8,prophesy,1783911906274681174
Will {{USERNAME}} testimony be today’s birthday present for {{USERNAME}} from {{USERNAME}}  ? {{USERNAME}} {{USERNAME}} {{USERNAME}} {{URL}},2024-04-26,8,prophesy,1783911883315323132
"{{USERNAME}} The last line ❤️❤️❤️❤️❤️		God has done it, you are healed and made whole 🙏 and your testimony will be permanent.		Congratulations in advance",2024-04-26,8,prophesy,1783911844333179160
"{{USERNAME}} {{USERNAME}} {{USERNAME}} Per sworn testimony from both SAAs, neither of them spoke with any Congressional leadership on the matter prior to J6.  Should they have?  Absolutely.  This is why I lay the blame on them.",2024-04-26,8,prophesy,1783911757175787978
Any offseason requires a coach's utmost attention to detail. Their development cannot be emphasized enough. Leadership maturation benefits each student-athlete on the receiving end of instruction and encouragement. #Leadership #CollegeSoftball,2024-04-26,8,prophesy,1783911755598512485
"{{USERNAME}} Mentioning Melania during his testimony could complicate Trump's legal strategy, possibly drawing more personal scrutiny and emotional responses into the proceedings. This move might affect public perception and the overall narrative of the case.",2024-04-26,8,prophesy,1783911629052096994
"{{USERNAME}} This black lady has not taken anyone's life, but your defense and encouragement of violent actions have resulted in the deaths of tens of thousands of innocent women, men, and children. Many believe that your instigation led the Israelis to assassinate Dr. Refaat Alaarer to gain… {{URL}}",2024-04-26,8,prophesy,1783911621384966387
{{USERNAME}} {{USERNAME}} {{USERNAME}} {{USERNAME}} {{USERNAME}} {{USERNAME}} There’s a video about the Kandahar Giant. It’s 4 parts &amp; it’s on Bitchute channel High Command (Timothy Holmseth). There’s 4 parts I believe &amp; is it’s pretty wild. It aligns w/ Caleb’s testimony as well. Caleb said he was there also.,2024-04-26,8,prophesy,1783911619069628419
{{USERNAME}} “ Trump at hush money trial wishes Melania ‘happy birthday’ as testimony about trysts continue “ - {{URL}} 4/26/24.		Nice birthday gift ?,2024-04-26,8,prophesy,1783911610362564826
"Now that Aunty Vera of the testimony saga is a celebrity, it might be a good time to closure to the arguments with this opinion of the NBA president. {{URL}}",2024-04-26,8,prophesy,1783911585343320138
Send you love and encouragement my 👑 	{{USERNAME}},2024-04-26,8,prophesy,1783911581044380110
"{{USERNAME}} Except earlier in the same testimony Pecker said that was because of McDougal’s wishes, not Trump’s.",2024-04-26,8,prophesy,1783911562685669572
{{USERNAME}} Shocking revelation! David Pecker's testimony unveils a troubling web of influence and manipulation surrounding the 2016 election.,2024-04-26,8,prophesy,1783912838429339832
Here is a testimony from one of My Clients in Africa {{URL}},2024-04-26,8,prophesy,1783912816837009572
"{{USERNAME}} {{USERNAME}} My point is that, in general, testimony alone is insufficient to warrant belief. Unless you're just making a special exception for the bible..?",2024-04-26,8,prophesy,1783912784700575860
{{USERNAME}} Will {{USERNAME}} testimony be today’s birthday present for {{USERNAME}} from {{USERNAME}}  ? {{URL}},2024-04-26,8,prophesy,1783912757680877947
"Trump ‘Hush-Money’ Witness Admits to Inconsistencies in Testimony, FBI Report {{URL}}",2024-04-26,8,prophesy,1783912748654514634
"As KUEMA we thank you all for joining us at the handover party. Your presence made the event truly special and meaningful. It's been an incredible journey, and your support and encouragement mean the world to us.👏👏	{{USERNAME}} 	{{USERNAME}}	{{USERNAME}} 	{{USERNAME}} {{URL}}",2024-04-26,8,prophesy,1783912679058427918
"{{USERNAME}} Considering you have shown very little grasp of the law, if you actually listened to the testimony your client is guilty as sin and it appears the DA's got all the receipts. I expect the jury will only take a couple of hours to find him guilty. But you're pretty so don't worry.",2024-04-26,8,prophesy,1783912667918315885
I know where near have it all together. I’m working on myself everyday. I hope that seeing my testimony shows people there’s nothing you can’t do if you don’t give up. God may deter you from the things He doesn’t want for you. But what’s meant to be will be. Just keep going!,2024-04-26,8,prophesy,1783912629884391661
{{USERNAME}} Will {{USERNAME}} testimony be today’s birthday present for {{USERNAME}} from {{USERNAME}}  ? {{URL}},2024-04-26,8,prophesy,1783912628278202727
"{{USERNAME}} {{USERNAME}} Still doesn't. All negative testimony is personally manufactured by Biden in his secret testimony workshop. In China, of course.",2024-04-26,8,prophesy,1783912557591335323
"Eternity is being determined right now in #MaturinConference		Matthew 24:14 And this gospel of the kingdom will be preached in the whole world as a testimony to all nations, and then the end will come. {{URL}}",2024-04-26,8,prophesy,1783912470257586376
"{{USERNAME}} {{USERNAME}} {{USERNAME}} The Jews reject the apocryphal books.  These were books written after the period of prophesy had ceased and considered without authority.  Come on, dude - don’t go after the Reformers.  They were mostly Romanists who found Christ by the Holy Spirit.  Praise the Lord for them!",2024-04-26,8,prophesy,1783912411952472274
{{USERNAME}} “ Trump at hush money trial wishes Melania ‘happy birthday’ as testimony about trysts continue “ - {{URL}} 4/26/24.		So Trumpy like.,2024-04-26,8,prophesy,1783912399776739438
"{{USERNAME}} Then how on earth could he be a high priest and, because of this, why could he prophesy.",2024-04-26,8,prophesy,1783912396966306029
"{{USERNAME}} OMGGGG SEOBAL SAMAAA 😭🫂💖💖💖I feel like crying, you have given me so much encouragement😭😭🫂💖💖It is so precious to my heart.🫶💖💖💖💖ILYSMMMMM😭🫂💖💖💖",2024-04-26,8,prophesy,1783912387567096104
"If you're seeing this post, give our runners some encouragement ahead of this weekend's marathon, half and 10K! 👇 {{URL}}",2024-04-26,8,prophesy,1783912335372873819
"{{USERNAME}} Haha, is Trump really wishing his wife happy birthday just before he walks into court that witness testimony says Trump paid hush money to women",2024-04-26,8,prophesy,1783912327135313922
"{{USERNAME}} Despite the frigid temps of the courtroom, Pecker did not shrink from continuing his damning testimony. 😎",2024-04-26,8,prophesy,1783912316083351811
"Running Buddies Volunteer, Peter Litts, loves connecting with the children participating in the 5K run. His encouragement and enthusiam motivates them to keep pushing to the finish! We appreciate your encouragement and time dedicated to the youth of Austin! #VolunteerAppreciation {{URL}}",2024-04-26,8,prophesy,1783912238778065096
"Taking the stand in Donald Trump’s historic hush money trial, David Pecker described how the National Enquirer became a campaign instrument—and rehashed his glory days. {{URL}}",2024-04-26,8,prophesy,1783912182641492465
"{{USERNAME}} Nonetheless, binding principles are spurned. America, Israel, and rogue NATO partners violate them with impunity. Crimes of war, against humanity, and genocide are official policy. Millions of corpses bear testimony. (Raphael Lemkin)",2024-04-26,8,prophesy,1783912160818594085
Judge Cannon Unseals Docs Alleging Jack Smith's Lead Prosecutor Threatened Trump Valet Attorney and Tried to Bribe Him in Exchange For Client's Testimony Against Trump {{URL}} #gatewaypundit via {{USERNAME}},2024-04-26,8,prophesy,1783912160789160256
{{USERNAME}} LOL Cockilicious yesss 🤣		Thank you for the encouragement!,2024-04-26,8,prophesy,1783913539670782167
Developing: David Pecker's Testimony Destroys Prosecution's Case Against Trump {{URL}} #gatewaypundit via {{USERNAME}},2024-04-26,8,prophesy,1783913504891932793
"{{USERNAME}} {{USERNAME}} {{USERNAME}} {{USERNAME}} {{USERNAME}} Act 2:17 same as in Joel.		""In the last days, God says, I will pour out my Spirit on all people. Your sons and daughters will prophesy...""		I guess when these women prophesy these men will point to these verses with their pretext and try and convince others to not listen.",2024-04-26,8,prophesy,1783913423828558011
{{USERNAME}} {{USERNAME}} Mine identifies as a happy encouragement tool.,2024-04-26,8,prophesy,1783913419537785180
"{{USERNAME}} {{USERNAME}} There's a big difference between ""he said she said"" and sworn testimony!		Although this explains why you magabillies get everything wrong!",2024-04-26,8,prophesy,1783913409672622526
"{{USERNAME}} {{USERNAME}} Are you suggesting it was only Michael Cohen or Pecker’s scheme and Trump didn’t initiate, approve or know about it? Because that’s the only other possibility- that Pecker or Cohen were on a frolic of their own (which seems highly unlikely given Pecker’s testimony).",2024-04-26,8,prophesy,1783913366660022536
Trump's lawyers try to discredit testimony of prosecution's lead witness in hush money trial (from {{USERNAME}}) {{URL}},2024-04-26,8,prophesy,1783913323165008284
{{USERNAME}} Pecker’s testimony blows holes in the prosecution’s case. Totally exonerates Trump,2024-04-26,8,prophesy,1783913305632907461
{{USERNAME}} It has become apparent why he is pushing so hard to get all these trials pushed back.  The testimony yesterday laid bare his lying and cheating in any way possible to get power.  A crooked son of a bitch if ever there was one!  Imagine what truth will come out in other trials.,2024-04-26,8,prophesy,1783913294715039890
{{USERNAME}} How are you going to only update people on prosecution elicited testimony and completely leave off all the testimony on cross examination.		Does accurate reporting mean anything to you?,2024-04-26,8,prophesy,1783913267405984090
"Through the integrity of God's word, we know that there's no situation too big for God to change.		Tonight, lay down every challenge before the Lord believing that every mountain in your  life is been removed. Trust God absolutely tonight, that you will receive a testimony.",2024-04-26,8,prophesy,1783913212460650532
"দ্বিতীয় পৰ্যায়ৰ সফল সামৰণি, এতিয়া লক্ষ্য ৭ মে!		With the successful completion of the phase-II of the LS Elections today, the team led by {{USERNAME}} sir now aims at the final phase in Assam on May 7th. The overwhelming support and encouragement received during the initial… {{URL}} {{URL}}",2024-04-26,8,prophesy,1783913140671156492
{{USERNAME}} {{USERNAME}}  {{USERNAME}} Bud's leadershipship skills are impeccable snd testimony to the fact that he is still with the SAME team for years.  It is not only his 'excellence' in the ring was under estimated but also his intelligence which is evident to his actions lately,2024-04-26,8,prophesy,1783913087105454123
{{USERNAME}} {{USERNAME}} Will {{USERNAME}} testimony be today’s birthday present for {{USERNAME}} from {{USERNAME}}  ? {{URL}},2024-04-26,8,prophesy,1783913059184218285
"{{USERNAME}} {{USERNAME}} {{USERNAME}} {{USERNAME}} I guess you're not keeping up with the newly released information about j6. If it was so clear, then why didn't the j6 panel want to talk to all the witnesses? Why did they destroy a lot of the testimony from those who spoke out and didn't agree with their narrative?",2024-04-26,8,prophesy,1783912991613735070
"""Then she'll remember you as the last time she saw you. You probably don't need to mention your sins to her. A mother's encouragement is one of the best things in the world.""		Then Melody stops talking, realizing something in that moment... {{URL}}",2024-04-26,8,prophesy,1783912991408230679
{{USERNAME}} Will {{USERNAME}} testimony be today’s birthday present for {{USERNAME}} from {{USERNAME}}  ? {{USERNAME}} {{URL}},2024-04-26,8,prophesy,1783912938354708668
{{USERNAME}} This testimony underscores the importance of transparency and accountability in our electoral processes. We deserve to know the truth.,2024-04-26,8,prophesy,1783912934982262990
{{USERNAME}} Guilty defendant. Damning testimony from his friend.,2024-04-26,8,prophesy,1783912923561173078
{{USERNAME}} What a sweet boy. I’m sure Cindy can give him some encouragement with weight loss.,2024-04-26,8,prophesy,1783912922923864259
"{{USERNAME}} 👆 Funny how one statement of encouragement can get perverted and rejected, resulting in my condemnation, by a Hyperpapalist.",2024-04-26,8,prophesy,1783912911968072033
"{{USERNAME}} {{USERNAME}} This was not a good witness for the prosection, if you think so you're probably not reading the testimony and being told what to think. He literally admitted to doing this for Arnold Swartznegger, Rahm Emanuel and many others.",2024-04-26,8,prophesy,1783912909245985179
{{USERNAME}} Will {{USERNAME}} testimony be today’s birthday present for {{USERNAME}} from {{USERNAME}}  ? {{URL}},2024-04-26,8,prophesy,1783914330544873744
Hi I'm running {{USERNAME}}'s Goonscript!❤️		It's forced experience with some encouragement and suprises😘		#techdom #findom #virus #blackmail #infoplay #goon #anydesk #2dfd #hypno #clickslut #linkslut #accountplay		{{URL}},2024-04-26,8,prophesy,1783914315076276613
"To the law and to the testimony: if they speak not according to this word, it is because there is no light in them.	Isaiah 8:20 {{URL}} {{URL}}",2024-04-26,8,prophesy,1783914299737399752
"{{USERNAME}} Like Balaam, forced to prophesy what he did not intend (Numbers 24:10-13), Caiaphas was made to predict the true significance of Christ’s coming death.",2024-04-26,8,prophesy,1783914296470118838
{{USERNAME}} My barber openly abused RG. He didn’t even need encouragement. He says RG is a Nashida. It was hilarious. People know RG for what he is.,2024-04-26,8,prophesy,1783914278845878486
Former NRP officer charged with perjury says ‘inaccurate’ testimony due to PTSD {{URL}} via {{USERNAME}},2024-04-26,8,prophesy,1783914186386370649
