text,date,label,label_name,id
"{{USERNAME}} {{USERNAME}} {{USERNAME}} {{USERNAME}} You ignored sworn witness testimony from the person who was closest to both Rittenhouse and Rosenbaum when he testified that Rosenbaum initiated the chase and lunged for the rifle when he cornered Rittenhouse. 		Based on that, I made a reasonable assumption that you are trolling.",2024-04-28,8,prophesy,1784712883336511965
"{{USERNAME}} Could be. But What they meant for evil God sometimes turns to good - pastors on news telling of God's faithfulness, the flock turning to God for their supply, a testimony to the neighborhood and great community of how Christians respond to evil against them.	NOT advocating evil.… {{URL}}",2024-04-28,8,prophesy,1784712830148612175
"🫶❤️Mr. Salahaddin organized a charity event for Al Madyouna, a rural area. We provided Ramadan baskets to 15 local poor families, hoping to help more needy people through our actions during this holy month of Ramadan.		🫶❤️Every charitable act is a testimony to the Dolphin… {{URL}} {{URL}}",2024-04-28,8,prophesy,1784712818547376162
"{{USERNAME}} No, because everyone will interpret the ""intrinsic meaning"" of the words differently. For there to be stability a point of reference needs to be made. That point of reference is the judicial interpretation of law. Without it, the law means anything and everything, rendering it… {{URL}}",2024-04-28,8,prophesy,1784712779737473279
"{{USERNAME}} {{USERNAME}} {{USERNAME}} {{USERNAME}} {{USERNAME}} {{USERNAME}} And this was his pinned thread on his profile for almost a year. ""Speculation""? Seems to me it's encouragement for establishing an eschatological foundation/understanding. So tell me why i should believe a word he says when he has presented himself in such contradictory ways. {{URL}}",2024-04-28,8,prophesy,1784712778588017028
{{USERNAME}} {{USERNAME}} Literally gave you the definition based upon the Bible especially if you have any understanding of the 1828 dictionary.		But alas modernism rears it ugly head in another lost soul who invents a private interpretation for themself.,2024-04-28,8,prophesy,1784712767796355341
{{USERNAME}} {{USERNAME}} Context is always important in the interpretation of a statement. Never miss that. {{URL}},2024-04-28,8,prophesy,1784712767649271836
{{USERNAME}} {{USERNAME}} Every day {{USERNAME}} it's the same hyped chart grabbing event sensationalizing dross chaff presented by the same people. Thank you {{USERNAME}} for the correct interpretation.,2024-04-28,8,prophesy,1784712767640928392
{{USERNAME}} {{USERNAME}} What do you have against self defense? 		Rittenhouse didn't break any laws. FACT. 		He justifiably defended himself against unprovoked attacks. FACT. 		All supported by witness testimony. FACT.,2024-04-28,8,prophesy,1784712737785893120
Breaking down the lies in Trudeau's testimony to the elections interference commission {{URL}} via {{USERNAME}},2024-04-28,8,prophesy,1784712731532169610
"{{USERNAME}} {{USERNAME}} {{USERNAME}} A special thanks to Larry McQueary, Jim Hallett and everyone in the front office who have entrusted me with the microphone. It is a dream job and I'm grateful for their support and encouragement (as well as helping us get to the away games in the postseason this year).",2024-04-28,8,prophesy,1784712716445237710
"Continued: ""has deferred the program to later in the year. The deferral is not because of the political views or identity of anyone involved with the program. We don’t comment  on the interpretation of an individual’s views or backgrounds."" ...",2024-04-28,8,prophesy,1784712707729744306
{{USERNAME}} {{USERNAME}} Thank you for your testimony {{URL}},2024-04-28,8,prophesy,1784712688544686551
{{USERNAME}} “Jeff Sessions’s testimony that he opposed a proposal for Donald Trump’s 2016 campaign team to meet with Russians has been contradicted by 3 people who said they had spoken…to investigators with special counsel Robert Mueller or congressional committees.”	{{URL}},2024-04-28,8,prophesy,1784712610627150329
"#DojoTraining - Graduate of the Day #40		RBorja 🎓 1000-1100 ➡️ 1100-1200		""Next month I'll turn a year in the Dojo and it has been great. Having a structured program with clear tasks and goals keeps me focused and improving. Being able to graduate 4x is the best testimony."" {{URL}}",2024-04-28,8,prophesy,1784712600577556856
"When I woke up in the morning, I received many messages of encouragement and I am very happy. {{URL}}",2024-04-28,8,prophesy,1784712575374291178
"{{USERNAME}} {{USERNAME}} If the SC were solidly liberal, they would not invest so much trust in the outcome. They need a corrupt conservative majority to trust the outcome. 		This is not how it was supposed to be. Upholding precedent and interpretation of the law were their remit before Federalists 1/",2024-04-28,8,prophesy,1784712572265959930
{{USERNAME}} {{USERNAME}} I couldn’t get past her misuse of the word ‘inherent’ as it made the rest of the sentence unintelligible. I’ll go with your interpretation.,2024-04-28,8,prophesy,1784712506545742032
"{{USERNAME}} Yes, in the sense that the interpretation of the facts and experiences of my life are ever-changing, with no certain truth on the horizon.",2024-04-28,8,prophesy,1784712477252722855
{{USERNAME}} {{USERNAME}} Ok… 😂 thank you for the encouragement! 😂 I’m doing that for fun… I’m not starting a business. 😜,2024-04-28,8,prophesy,1784712472630374715
My best friend {{USERNAME}} never charged me for all the help she’s given me. I still call her sometimes before sessions lmao we all need a little advice or encouragement sometimes. I genuinely think men are nothing and deserve to be robbed blind. Ima help you do that 😂,2024-04-28,8,prophesy,1784712465609105642
"{{USERNAME}} I can't speak for every Alba voter - neither can you - but there was widespread anger among founder Alba members toward NS, especially after the testimony that she gave.		Do you remember it differently?	We can find some Twitter comments from that time.	They might be illuminating.",2024-04-28,8,prophesy,1784712446122352873
"{{USERNAME}} {{USERNAME}} {{USERNAME}} {{USERNAME}} {{USERNAME}} Even IF any of your brainfarts made sense, you're still no closer to your particular interpretation of your favourite mythical deity. {{URL}}",2024-04-28,8,prophesy,1784712409783115993
"Donald Trump Was 'the Most Animated' During 'Uncomfortable' Testimony About His Alleged Affairs, Reporter Claims	{{URL}}",2024-04-28,8,prophesy,1784712408810070211
did my own interpretation of human para (with the wife)	#GuiltyGear #guiltygearfanart #ABA #GGST #guiltygearart #Paracelsus {{URL}},2024-04-28,8,prophesy,1784712404904952251
"{{USERNAME}} In spite of the upcoming testimony against Tiny D Trump, it’s good to see you’re staying busy. Sometimes we all have to do that so we don’t get stressed out.",2024-04-28,8,prophesy,1784712386126958903
Fund manager indicates Jim Biden was in business with Qatari officials - POLITICO		daaaaaa {{URL}},2024-04-28,8,prophesy,1784712327104753906
"PEOPLE SAY THIS IS THE WORST ONE!?	WHY!?!?!?!		THIS WAS SO MUCH FUN, THIS WAS AN ACTUAL *VISION* SOMEBODY HAD FOR ONCE IN THIS UNIVERSE'S LIFE!!!		YOU'RE REALLY TELLING ME YOU'D RATHER SEE SOME BOTCHED INTERPRETATION OF KNUCKLES FLAIL ABOUT THAN WATCH *THIS*!?!?!?!?! {{URL}} {{URL}}",2024-04-28,8,prophesy,1784712316673478832
{{USERNAME}} {{USERNAME}} {{USERNAME}} {{USERNAME}} {{USERNAME}} {{USERNAME}} {{USERNAME}} {{USERNAME}} {{USERNAME}} {{USERNAME}} {{USERNAME}} {{USERNAME}} {{USERNAME}} More impressive testimony.  I predict we’ll be seeing more tripods on the mound instead of live pitching for BP in the near future.  I mean do you really need to hit a ball when you have the at release mode?,2024-04-28,8,prophesy,1784712316111458721
"“My family could provide a wealth of introductions and business opportunities at the highest levels that I believe would be worthy of the interest of His Excellency,” and, “On behalf of the Biden family, I welcome your interest here.” #Qatar {{URL}} via {{USERNAME}}",2024-04-28,8,prophesy,1784712301381144949
"{{USERNAME}} A ""Calvinist interpretation"" is the very definition of eisegeses.",2024-04-28,8,prophesy,1784712281541972184
{{USERNAME}} {{USERNAME}} January 1970. It was in the ‘trial separation’ phase 	. So from John’s outburst in September 69 he was trying to row things back. Sang Instant Karma for him in February. But it became impossible for him with the interpretation of Paul’s press release in April.,2024-04-28,8,prophesy,1784712275531575434
"{{USERNAME}} Same as Iran. Mind you Iranian Islamic terrorism has occupied Gaza for 20 years. Why does anyone support Islam. Islam hates woman, with practices like veiling, stoning, FGM, and unequal legal testimony. These issues of gender equality within the religion are just the beginning.",2024-04-28,8,prophesy,1784712120330043493
"{{USERNAME}} I understand what you are saying and feeling. 		I still in my heart believe I was the worst of the worst and have the hardest time understanding how God could love me let alone forgive me.  		Keep encouraged, you have so quickly become a blessing and encouragement.  		You are… {{URL}}",2024-04-28,8,prophesy,1784712111668510810
{{USERNAME}} DM you?  I'm just an average guy who recognizes a true soul. I will do that. Perhaps we can be friends and share mutual encouragement in positivity.,2024-04-28,8,prophesy,1784712092823458062
"{{USERNAME}} During your Senate Watergate testimony, we stopped everything, a big TV was wheeled into our high school class, capturing everyone's deep attention. We delved into discussions for an hour afterward, including a spirited debate. Those days epitomized our proficiency in civics,… {{URL}} {{URL}}",2024-04-28,8,prophesy,1784712020224319710
"Hey everybody!	I'm a physical paint artist, recently into this much inspiring NFT world; love it!	Here's my Objkt and my 2 last paintings.	Those are 2 of my interpretation of them bored apes.	{{URL}} {{URL}}",2024-04-28,8,prophesy,1784711936011042997
"""From The Inside"" PT I (Acts 19:1-7-MSG) is the source of your discernment for decisions and actions that Engage Your Soul, Engage Your Reality, and Engage Your Testimony to Open Up The Way to God's promises fulfilled in your life.  #OpenUpTheWay  {{URL}}",2024-04-28,8,prophesy,1784711918306926746
"{{USERNAME}} {{USERNAME}} If that's your case it's fine, but I don't pull that interpretation out of my head, I literally quoted self called Aerith stans using it to outline Aerith pettiness, and plenty of other people also said they read it as petty, so why come target me and not the OG post ?",2024-04-28,8,prophesy,1784711915966493146
Inthe moon a testimony of success is		▬نمشؾ▬	◗H20◖		▬ٺون▬	◗888N◖,2024-04-28,8,prophesy,1784711886178578673
"Bombshell Testimony Reveals Links Between James Biden, Foreign Government With Terror Ties {{URL}}",2024-04-28,8,prophesy,1784711858902962485
{{USERNAME}} {{USERNAME}} {{USERNAME}} Marxist theory isn't divorced from reality.		YOUR Marxist theory and YOUR INTERPRETATION of Marxist theory is divorced from reality.		There is a difference.,2024-04-28,8,prophesy,1784711832541794410
"🚨Testimony: This is Reem Hamdaqah, the sole survivor who lost 14 members of her family and even her cat in an Israeli bombardment on her uncle's house in Khan Yunis - Southern #Gaza Strip.		She suffered complex fractures in the pelvis and hip joint . {{URL}}",2024-04-28,8,prophesy,1784711805752811970
{{USERNAME}} This outlandish interpretation of everything that any Republican says is getting ridiculous.  He did not say inject bleach moron. Theae hollow fallacys are absurd.  He said look into something that can cleanse like bleach or something of that.,2024-04-28,8,prophesy,1784711767530049564
{{USERNAME}} This is y Pecker brought these “celebrities” up in his testimony. To help his bud tfg &amp; give repugs an out and a perfect deflection with “buh buh but other famous people did it tooooooo”. #TrumpWin #DojFailedUAll,2024-04-28,8,prophesy,1784711725176283334
"All of this is intentional... every bit.	Resentful groups, disparate, unhinged, etc... will continually join together to create destruction and chaos through violence.	But most importantly, they've achieved not only acceptance but encouragement {{URL}}",2024-04-28,8,prophesy,1784711707018830011
"{{USERNAME}} Bombshell Testimony Reveals Links Between James Biden, Foreign Government With Terror Ties {{URL}}",2024-04-28,8,prophesy,1784711698919698627
"{{USERNAME}} 		Bombshell Testimony Reveals Links Between James Biden, Foreign Government With Terror Ties {{URL}}",2024-04-28,8,prophesy,1784711665981723055
"Revelation 19:10		And I fell at his feet to worship him. But he, the angel, said to me, “See that you do not do that! I am your fellow servant, and of your brethren who have the testimony of Jesus. Worship [not Angels, but] God!",2024-04-28,8,prophesy,1784711661204467951
"{{USERNAME}} {{USERNAME}} {{USERNAME}} David...you will find that kind of welcome in any Palestinian family anywhere in the world and even more so in Gaza, E. Jerusalem &amp; the West Bank. Thank you for your testimony. I am so glad you had the chance to experience it. 🙏",2024-04-28,8,prophesy,1784711652895510827
"{{USERNAME}} Bombshell Testimony Reveals Links Between James Biden, Foreign Government With Terror Ties {{URL}}",2024-04-28,8,prophesy,1784711626228105566
{{USERNAME}} This conflates the meaning of the law and the meaning of the interpretation. The law has an intrinsic meaning based its words. The interpretation of the law by a court has meaning based on the opinion of the court. Rigid judicial supremacy places the interpretation above the law.,2024-04-28,8,prophesy,1784711605801906611
"contextual details""?? What is it even talking about and how is this a fact check of what essentially is someone giving an interpretation to a piece of media. This is as if I were to say that Princess Mononoke is about ecologism and the community notes saying that it isn't (4)",2024-04-28,8,prophesy,1784711600949071918
"{{USERNAME}} Hebrews 10:24-25 says, “And let us consider how to stir up one another to love and good works, not neglecting to meet together, as is the habit of some, but encouraging one another, and all the more as you see the Day drawing near.” Staying in faith is easier with encouragement.",2024-04-28,8,prophesy,1784711594598928426
"{{USERNAME}} Bombshell Testimony Reveals Links Between James Biden, Foreign Government With Terror Ties {{URL}}",2024-04-28,8,prophesy,1784711592908628417
"{{USERNAME}} Bombshell Testimony Reveals Links Between James Biden, Foreign Government With Terror Ties {{URL}}",2024-04-28,8,prophesy,1784711561010909540
"{{USERNAME}} 		Bombshell Testimony Reveals Links Between James Biden, Foreign Government With Terror Ties {{URL}}",2024-04-28,8,prophesy,1784711521919963446
"Viewing humans as a universal elixir is a profound interpretation. Our capacity for transformation and creation is limitless. We have the ability to turn ""base materials into gold"" through innovation, art, science, and industry. Our brains, rich with knowledge and creativity, can… {{URL}}",2024-04-28,8,prophesy,1784711520154235165
"(oh! Her[thus mine- in my Michigan-&gt;Los Angeles cousin’s interpretation and application of the series to our lives📚]whole first name nudged her &amp;or it’s staged- we won’t ever decide: have to, get to , want to make up your mind)",2024-04-28,8,prophesy,1784711497920504272
"Thank you for sharing this video. If it wasn’t for this man’s testimony, I would have considered the shot. I tried to stop my family and friends but they  didn’t listen. I don’t know how many will live healthy in 5 years. Some have already died. {{URL}}",2024-04-28,8,prophesy,1784711460909920475
5. Don't be afraid to share your pain. God uses our pain and testimony to help others 	Always remember that GOD is the source of all COMFORT 🤍,2024-04-28,8,prophesy,1784711443624935891
"{{USERNAME}} you know you can make your phone read text to you if you're having trouble comprehending? 		i literally just said this interpretation of wolverine doesn't like the helmet, which can be proven. don't get pissed at me, i didn't choose to advertise him with it and then remove it.",2024-04-29,8,prophesy,1784754452013924735
{{USERNAME}} Good Morning Let the morning breeze whisper words of encouragement and inspiration in your ear. 🍃,2024-04-29,8,prophesy,1784754451405828439
"I'm very grateful to my friends. It's because of their encouragement and appreciation that I can confidently share my OC.They wrote many paragraphs and drew many pictures for me. I quietly saved them all.	They genuinely love my characters, and I've always remembered that.",2024-04-29,8,prophesy,1784754406787002385
"{{USERNAME}} Lynch's Dune was way super duper dreamy and into the mysticism.  The recent movies are also super into the mysticism but also tempered with the political view that the prophesy was seeded by the Bene Gesserit to begin with.  I love the new ones and I think they may surpass Lynch,",2024-04-29,8,prophesy,1784754315644555507
{{USERNAME}} {{USERNAME}} No. As a refugee (as spurious as that is) refoulement is precluded in NZ's lax interpretation of the 1951 Convention and 1967 Protocol Relating to the Status of Refugees. If NZ was a real democracy with an actual rule of law he would have been deported already.,2024-04-29,8,prophesy,1784754315363770450
"🙌🗣️📢Amen 🎯✝️🤍🔥📣📣		Revelation 12:11📖		🕊️”And they overcame him by the➡️blood of the Lamb🎚️, and by➡️the word of their testimony; and they loved not their lives unto the death.“🕊️✝️💖🛐🔥 {{URL}}",2024-04-29,8,prophesy,1784754301199339541
"remember them no more. ‘By this ye may know if a man repenteth of his sins–behold, he will confess them &amp; forsake them.’ Find encouragement in the lives of Alma the Younger &amp; the sons of Mosiah. They were tragically wicked. Yet their full repentance &amp; service qualified them to 2/",2024-04-29,8,prophesy,1784754208979169519
"{{USERNAME}} That's not so bad! Honestly him being buff or not is open to interpretation. He got to be pretty old by the end of his journey, but he was a soldier who killed like forty men in a room, so...",2024-04-29,8,prophesy,1784754112011329852
{{USERNAME}} {{USERNAME}} {{USERNAME}} Will there be Congressional testimony from State Department officials?🤔,2024-04-29,8,prophesy,1784754031174316041
{{USERNAME}} I am so thankful for your sharing of this amazing experience. Truly humbling and testimony affirming. God is there. We are his children. He loves us more than we can comprehend.,2024-04-29,8,prophesy,1784753974572196299
It’s all in your interpretation. #Health {{URL}},2024-04-29,8,prophesy,1784753933480841618
{{USERNAME}} They need help not encouragement,2024-04-29,8,prophesy,1784753848764035102
"I got copy of morning transcript of Microsoft CEO testimony in Google Search antitrust trial, posted here:	{{URL}}",2024-04-29,8,prophesy,1784753835036033285
To interpretation. grace and mercies. You are where Americans learn		▬نمشؾ▬	◗W77◖		▬ٺون▬	◗FVF◖,2024-04-29,8,prophesy,1784753790865805334
Here's another dream interpretation from #ChatGPT {{URL}},2024-04-29,8,prophesy,1784753763254927782
"{{USERNAME}} {{USERNAME}} Huh... I agree with some of that, but opinion noticeably diverged during the GW arc interpretation. I thought it was quite clear that “revenge is for oneself”-this was sth both Ciel had to realize, and Sebby was trying to help him realize.",2024-04-29,8,prophesy,1784753757189705960
{{USERNAME}} {{USERNAME}} {{USERNAME}} Thank you veryyl much for your kind words and encouragement! It's always greatly appreciated and very uplifting!,2024-04-29,8,prophesy,1784753714227495309
"Success is not an accidents, but persevere working, learning, studying, and sacrificing  everything you have just to achieve it, and most of all love what you are doing or learning to do. because when we strive well everything around us  becomes better and Successful. 	#Testimony {{URL}}",2024-04-29,8,prophesy,1784753674373242928
{{USERNAME}} {{USERNAME}} Truth is often vile to deceivers.		And the stack of manure in your post is all your warped interpretation. The email merely states facts.,2024-04-29,8,prophesy,1784753655071011031
"{{USERNAME}} {{USERNAME}} {{USERNAME}} There are already intensive video reviews, both group and individual sessions, plus self assessment, plus training. 		Agree on simplifying the rules though, so many are open to interpretation.",2024-04-29,8,prophesy,1784753640156410287
"When I stayed with my parents, my father did some prophesy and some backwards talking at me. one thing I didn't catch/understand was ""If you're shitting clay you're in trouble"" he talked backwards. ""you're gonna be in trouble if you eat your brother Clayton""",2024-04-29,8,prophesy,1784753632627290581
"These various bibles co's trying to change interpretation of the word of God to suit them, God gave a warning to those who try to change the word of God in Revelation 22:18,19",2024-04-29,8,prophesy,1784753587630800994
{{USERNAME}} {{USERNAME}} because they are a human interpretation of God and humans tend to interpret phenomena they don't understand in a million ways. But that doesn't mean their explanations have any validity.,2024-04-29,8,prophesy,1784753546434371737
{{USERNAME}} Huh. I would have thought that a person would not be the holder of their own grand jury testimony. That instead the holder would be some justice-type organization. So someone like a judge could request a copy from that organization.,2024-04-29,8,prophesy,1784753442222936299
{{USERNAME}} {{USERNAME}} {{USERNAME}} {{USERNAME}} {{USERNAME}} No it quite literally means that is not what I said. You do not get to take my words and interpret them however you’d like and call YOUR interpretation MY beliefs.,2024-04-29,8,prophesy,1784753419141394468
"Just a quick reminder that prior to this certain people were moaning about the process and lack of data. 		Well here’s a data point from 2020 prior to David Grusch testimony. Think how far its gotten in 2024. Just because you’re not privy to the data, doesn’t mean it doesn’t… {{URL}} {{URL}}",2024-04-29,8,prophesy,1784753401055547690
{{USERNAME}} Lol oh really? And what is your interpretation of my results?,2024-04-29,8,prophesy,1784753384777748621
I ordered wings and was bummed cuz I saw the curly fries AFTER I already ordered but then the guy asked “you have 5?” and I said “uh I think it was an order of 6” and then he dumped curly fries into my box and smiled at me. This my testimony to God.,2024-04-29,8,prophesy,1784753362249961851
{{USERNAME}} I'm grateful I have a good woman in my life ❤️ 		Growing with her has been the best thing ever! 		Testimony soon,2024-04-29,8,prophesy,1784753327047127532
"{{USERNAME}} Honestly, I'm surprised that app hasn't been banned years ago I mean it seems like every 2 weeks they're pushing a new way to get people to injure or kill themselves and that's before all the pedo encouragement from the platform",2024-04-29,8,prophesy,1784753313159811442
"Hank Kunneman PROPHETIC WORD🚨[FALL DEFEAT] I SAW IT: Prophecy April 28, ... {{URL}} via {{USERNAME}}",2024-04-29,8,prophesy,1784753310144070005
"{{USERNAME}} {{USERNAME}} Bottom line is ( because we already established the fact you are as nazi as the sign author l), you can’t deny the fact this is a valid interpretation, hence the OP is not OBVIOUSLY wrong",2024-04-29,8,prophesy,1784753271686787317
"Podcast About The Bible, Encouragement,Scripture {{URL}} #1 Corinthians 12: 12: We Are All Members Of One Body",2024-04-29,8,prophesy,1784753146427830364
"{{USERNAME}} 3pm. Last day in the office before I move across the country to take a different pastoral call. Parishioner wants to meet; I think it is a final farewell and encouragement. Nope! One last time to grind a narrow theological axe, literally in the last minutes of my pastorate 🤦‍♂️",2024-04-29,8,prophesy,1784753129096978671
Our Alien Overlords | How We Secretly Serve The Tall Whites (27th April 2024).	Based on testimony from Charles Hall  who wrote the Millennial Hospitality series.  The former Canadian Minister of Defense read them all and recommended one.	{{URL}} via {{USERNAME}},2024-04-29,8,prophesy,1784753074302763120
"{{USERNAME}} {{USERNAME}} {{USERNAME}} Also you can't prove he's ""questioning it for effect"" anyway. You're again just taking the most charitable interpretation then start being skeptical towards anything that contradicts your arguments",2024-04-29,8,prophesy,1784753038948995382
"And all the gold fillings, if I might add. Prophesy says they'll be doing it for gain. {{URL}}",2024-04-29,8,prophesy,1784753033483854188
"{{USERNAME}} I declare and decree that this test will be his testimony, that everything that the enemy planned for bad will be turned into good! Cover him Lord with your mighty blood! I declare that no weapon formed against him or any other victim through similar circumstances will prosper!",2024-04-29,8,prophesy,1784753009970287021
"“The fundamental principles of our religion are the testimony of the apostles and prophets concerning Jesus Christ: that He was crucified, died, and rose again the third day.” - Joseph Smith {{URL}}",2024-04-29,8,prophesy,1784752929901347305
"{{USERNAME}} 	My interpretation of the last 24 hrs on the timeline:	""I'm a scout""	""No, you're not""	""Your entire fan base is toxic!"" {{URL}}",2024-04-29,8,prophesy,1784752925086220780
Fund manager indicates Jim Biden was in business with Qatari officials {{URL}} via {{USERNAME}},2024-04-29,8,prophesy,1784752918895243474
