text,date,label,label_name,id
"{{USERNAME}} Let's unite and elevate each other's efforts in farming by sharing knowledge, resources, and encouragement.",2024-04-28,8,prophesy,1784403599348601293
also im actually not trying to get everyone to watch the show. but if you think you could be succeptible to watching supernatural Consider this a tweet of encouragement,2024-04-28,8,prophesy,1784403598706663567
"{{USERNAME}} Very lovely photo of you two 😌 I have trouble doing photography shots myself and takes practice. 		Your encouragement, I might actually try uploading something of myself with mine lover when able. 😌 First step.",2024-04-28,8,prophesy,1784403588355109272
{{USERNAME}} Trump trial sees new witnesses on the stand to close out first week of testimony {{URL}}… via	{{USERNAME}}	oooops ?,2024-04-28,8,prophesy,1784403541165310186
{{USERNAME}} Trump trial sees new witnesses on the stand to close out first week of testimony {{URL}}… via	{{USERNAME}}	oooops ?,2024-04-28,8,prophesy,1784403450480169192
"{{USERNAME}} Sure it is! God gifts and calls whomever He wishes, and He’ll continue to do so without asking for man’s opinion. 		Paul also said that WHEN women pray/prophesy (in church), they should cover their heads. Also, we’re under grace, not law.",2024-04-28,8,prophesy,1784403438601642308
{{USERNAME}} Trump trial sees new witnesses on the stand to close out first week of testimony {{URL}}… via	{{USERNAME}}	oooops ?,2024-04-28,8,prophesy,1784403405580214640
"To any Zionists out there, if the slogan was ""From the river to the sea, PALESTINIANS will be free"" would that change your interpretation of it?",2024-04-28,8,prophesy,1784412304311783749
"How are you today? Has it gotten better yet?Hope it gets better every day. and will come back stronger soon.I'm worried about you. Always give encouragement, always love. 💪✌️💚	WE LOVE YOU MARK TUAN 	#GetWellSoonMarkTuan {{USERNAME}} {{URL}}",2024-04-28,8,prophesy,1784412298934878337
"{{USERNAME}} Thank you for your encouragement! 	It's my understanding that Hades (aka Sheol) is the temporary place of the dead.	Gehenna is the ""sub-division"" of Hades that is the temporary place of punishment for the unrighteous dead.	There is a gulf  between Gehenna &amp; Paradise (aka… {{URL}} {{URL}}",2024-04-28,8,prophesy,1784412268907672060
{{USERNAME}} I absolutely love this even if I do believe this verse is talking about herself and how she is now. But this is also a beautiful interpretation!,2024-04-28,8,prophesy,1784412264579076519
Sending you energy and big encouragement today. Happy shooting 📽️ 🌤️		INFINITY LOVE TO ENGFA28	#อิงฟ้ามหาชน #EngfaWaraha  {{USERNAME}} {{URL}},2024-04-28,8,prophesy,1784412252407492953
"Tip for establishing routines: Be patient and consistent as you introduce new routines, and offer plenty of praise and encouragement along the way. #Routines #ParentingHacks",2024-04-28,8,prophesy,1784412219888783826
"Dude calls a spade a spade.		If you read the Quran, would his interpretation be correct? Or am I ill informed &amp; ignorant of the truth.		Is the text simple enough for the average man to understand, or do I need someone else to help me interpret it ""correctly""?! {{URL}}",2024-04-28,8,prophesy,1784412217221460340
"{{USERNAME}} As much as I love the ""leave it up to interpretation"" some things should just be told on what it is, it's tiring when people debate whether something is this or that",2024-04-28,8,prophesy,1784412203308949924
Art does not provide knowledge. Replace all art with guns. You could still give the same interpretation. {{URL}},2024-04-28,8,prophesy,1784412191396859925
"{{USERNAME}} Ok twitter sheikh. What does خاتم mean?		Stop trying to run, I've locked the thread to only a few of you Jahil Nation apologists who were ""brave"" enough to come with layman understanding to defend a perverted Quran interpretation 		Explain to me using linguistic analysis",2024-04-28,8,prophesy,1784412151609770060
"{{USERNAME}} is my President and I couldn’t be prouder of his leadership, resolve and courage and I am grateful for his words of encouragement and for his enduring love for this country and its people. #WHCD	White House Correspondents Dinner",2024-04-28,8,prophesy,1784412019820569042
"{{USERNAME}} {{USERNAME}} Horrendous...		""According to new testimony by an Israeli eyewitness to the girl’s death, she was killed by an Israeli tank shell alongside several neighbors.""	{{URL}}",2024-04-28,8,prophesy,1784412010425503990
{{USERNAME}} I had held to that same interpretation and when this came out it solidified my understanding.   Great documentary.,2024-04-28,8,prophesy,1784411882713166294
{{USERNAME}} {{USERNAME}} {{USERNAME}} The English version was the agreed interpretation until 1985. At that time maori activists along with nieve govt rewrote the treaty BUT still general consensus was one govt one set laws still was correct version. There is far more proof that Maori new they were ceded soverignty.,2024-04-28,8,prophesy,1784411855085310065
"TRUE JUSTICE according  to the Holy Quran requires that if you have to give testimony against yourself  or our beloved ones you should do so”	-Hazrat Mirza Masroor Ahmad, Head of the Ahmadiyya Muslim Community	#StopWW3",2024-04-28,8,prophesy,1784411827910390014
"the idea that momentum reflects the relationship between an object and the time it takes for that object to undergo a change in motion.		While this interpretation may offer a philosophical or metaphorical insight into the nature of momentum, it's important to note that in physics",2024-04-28,8,prophesy,1784411759752712563
"{{USERNAME}} {{USERNAME}} So, your interpretation of my informed opinion is to call me an incel, misogynist and a female enabler?",2024-04-28,8,prophesy,1784411754686259428
{{USERNAME}} (4) It is also propaganda that immigrant workers improve the economy. They take more than they contribute and just increase the tax burden for the rest of us		{{URL}},2024-04-28,8,prophesy,1784411723631399088
Currently reading the academic literature on drowning and the one thing every survivor states is that it’s “extremely peaceful” and “you feel no fear” 		Like damn near every testimony echoes this in one way or another,2024-04-28,8,prophesy,1784411694158278803
"concept in understanding the dynamics of physical systems.		Your perspective suggests that momentum could be seen as a way of ""reading"" time, where the motion of an object provides information about the passage of time or the progression of events. This interpretation aligns with",2024-04-28,8,prophesy,1784411667423490557
"Your statement touches on an intriguing interpretation of momentum within the framework of time. In physics, momentum is traditionally defined as the product of an object's mass and its velocity. It describes the quantity of motion possessed by an object and is a fundamental {{URL}}",2024-04-28,8,prophesy,1784411578290282571
"{{USERNAME}} {{USERNAME}} They're not the colors of the lesbian flag. That is YOUR INTERPRETATION. Again, nothing wrong with the lesbian Robin headcanon but to say it's wrong to ship her with men is stupid. The colors on her cheek combined with the colors of her dress and hair call back to XIPE. She is-",2024-04-28,8,prophesy,1784411572275655020
{{USERNAME}} .........please be advised......this post has been deemed as an acceptable and appreciated interpretation to my timeline............👍😁✌,2024-04-28,8,prophesy,1784411517829706182
{{USERNAME}} change invariably occurs. My testimony is that I’ve had some of the most delicious moments of my life after surviving a period of suicidality. No positive thinking was required. Sometimes I swear resentment kept me alive. #Solidarity #YouDontHavetoLikeItToSurviveIt.,2024-04-28,8,prophesy,1784411501098664271
{{USERNAME}} Its very easy to ignore the movie because the ending of S1 is super open to interpretation,2024-04-28,8,prophesy,1784411495264088292
"btob has always been vocal about wanting to hear more of singer peuni. composer line giving him singing parts, wanting to hear more of his melodic raps, them passing him the mic during their parts of the song, etc. this is what constant encouragement does. thank u btob 😭",2024-04-28,8,prophesy,1784411483616747979
💌🤠👃🤴😮	 clearly membership testing moreover hill jet testimony,2024-04-28,8,prophesy,1784411402314350607
"{{USERNAME}} these 2024 Cultural Revolutionists are very weak when they are not getting regular potty breaks, starbucks chai tea, and constant words of encouragement from their parents.",2024-04-28,8,prophesy,1784411370701897927
History bears testimony that the Holy Prophet Muhammad(saw) forgave all the non-believers of Makkah when he entered this Holy City It is then commanded that the enmity of a people should not incite us to act unjustly	#StopWW3,2024-04-28,8,prophesy,1784411357103681644
The White Buffalo Prophesy.		This video is from 9 years ago. 		I was in tears and also very grateful that I get to live during this time. 		{{USERNAME}} I thought of you when he said this 🥰		{{URL}} {{URL}},2024-04-28,8,prophesy,1784411220327719304
"{{USERNAME}} {{USERNAME}} Appreciate the link, very thoughtful. The method used to transcribe the Hurrian Hymn to Nikkal is not as sophisticated as today's music notation systems. Alas, the version you’re hearing is an interpretation. Still interesting but just best guess.",2024-04-28,8,prophesy,1784411112194425191
{{USERNAME}} Up for interpretation 😜,2024-04-28,8,prophesy,1784411069831586038
"Whenever you come together, each of you has a psalm, has a teaching, has a tongue, has a revelation, has an interpretation. Let all things be done for edification.		1 Corinthians 14:26-33 (NKJV) {{URL}}",2024-04-28,8,prophesy,1784411040953819381
"“I raised up some of your sons as prophets, And some of your young men as Nazirites. Is it not so, O you children of Israel?” Says the Lord. “But you gave the Nazirites wine to drink, And commanded the prophets saying, ‘Do not prophesy!’”#iloveJesusChrist {{URL}}",2024-04-28,8,prophesy,1784411010696138911
"Interpretation: Today next year, you will already be in the clouds, when you can easily and happily watch the world's deeds still busy for fame. {{URL}}",2024-04-28,8,prophesy,1784410948046148025
{{USERNAME}} the tweet i’d QRTed before specifically used that word so to me it’s even weirder especially since they could’ve said “any resistance rhetoric” to go mask off but they wanted to divorce it from its obvious meaning and leave room for connotation or interpretation which 🤷🏻,2024-04-28,8,prophesy,1784410910762615177
"{{USERNAME}} {{USERNAME}} {{USERNAME}} It's not a question of beauty, but of affinity and synchrony, a lot of chemistry; beauty is just interpretation. It's real, they're beautiful!!	  #MahassineMerabet 	 #CenkTorun  #MahCen {{URL}}",2024-04-28,8,prophesy,1784410868295303650
Sending you lots of encouragement and positive energy for today's filming 🎬🎥 may everything be productive and with quality.		INFINITE LOVE TO ENGFA28	#อิงฟ้ามหาชน #EngfaWaraha 	{{USERNAME}} {{URL}},2024-04-28,8,prophesy,1784410763936829665
{{USERNAME}} {{USERNAME}} {{USERNAME}} Still alive. Updating my site with info as it becomes available. This is something that is actively affecting the world and there's stuff in the news every day that was in my testimony.,2024-04-28,8,prophesy,1784410763764945289
He invested with importance by making other prophets prophesy about it #StopWW3,2024-04-28,8,prophesy,1784410754701230525
#Islamahmadiyyat.He invested with importance by making other prophets prophesy about it #StopWW3,2024-04-28,8,prophesy,1784410663265395114
Before SCOTUS makes ANY decision about Trump they must see all of the evidence! There is loads of exculpatory evidence in testimony and video. Trump was NOT asking for not involved in an “insurrection” at any time. This is so important. {{USERNAME}} {{USERNAME}} {{USERNAME}} {{URL}},2024-04-28,8,prophesy,1784410630101078403
"“TRUE JUSTICE according  to the Holy Quran requires that if you have to give testimony against yourself  or our beloved ones you should do so”	-Hazrat Mirza Masroor Ahmad, Head of the Ahmadiyya Muslim Community-- 	#StopWW3 {{URL}}",2024-04-28,8,prophesy,1784410598987448774
"{{USERNAME}} The context given is correct, but the interpretation isn't. Trump does talk about light. Then he stops &amp; starts a new sentence about disinfectants. 'Will' had just talked about how bleach &amp; isopropyl alcohol can kill the virus in respiratory fluid, hence trump mentioning lungs",2024-04-28,8,prophesy,1784410561247318289
{{USERNAME}} {{USERNAME}} {{USERNAME}} no encouragement please,2024-04-28,8,prophesy,1784410527617167536
{{USERNAME}} {{USERNAME}} Thank you for always being a source of positivity and encouragement. {{USERNAME}} {{USERNAME}} {{USERNAME}},2024-04-28,8,prophesy,1784410491634524298
"{{USERNAME}} {{USERNAME}} {{USERNAME}} predestination interpretation on New Testament terms like: “elect” (Titus 1:1 ); “predestined” (Romans 8:28-29); “foreknown” (Romans 8:28); “chosen” (Ephesians 1:11) and “called” (Romans 1:6)."" {{URL}}",2024-04-28,8,prophesy,1784410479944741246
{{USERNAME}} What a great testimony and legacy. I'm sure that she impacted many for Christ. There will be a reunion before you know it.,2024-04-28,8,prophesy,1784410441231286688
Fitnah is open for interpretation,2024-04-28,8,prophesy,1784410388336963751
Natural language processing algorithms automate the interpretation of regulatory frameworks to ensure compliance in crypto businesses. {{URL}},2024-04-28,8,prophesy,1784410357223616818
"To dream of eloping is unfavorable. To the married, it denotes that you hold places which you are unworthy to fill, and if your ways are not rectified your reputation will be at stake. To the unmarried, it foretells disappointments… {{URL}} #Dream #Interpretation",2024-04-28,8,prophesy,1784410341490999403
"{{USERNAME}} Slightly unrelated, but how much time do we have left for Girkin's Kiev-Pecharsk schism prophesy?",2024-04-28,8,prophesy,1784410222624157987
📹🥰What is your interpretation of ‘Hangzhou feel’? Showcase your unique perspective of this dynamic city 🌇through your lens and join the Hangzhoufeel Creative Short Video Contest!  		More details：{{URL}}  		#Hangzhoufeel #CreativeShortVideo #Hangzhou… {{URL}} {{URL}},2024-04-28,8,prophesy,1784410202705674474
"{{USERNAME}} {{USERNAME}} {{USERNAME}} {{USERNAME}} Many will say to me on that day, 'Lord, Lord, ([only Christians calls Jesus lord]) did we not prophesy in your name and in your name drive out demons and in your name perform many miracles?	Then I will tell them plainly, 'I never knew you. Away from me, you evildoers!'	(Mathew 7",2024-04-28,8,prophesy,1784410170845528498
"in every universe and every interpretation, sherlock will forever outcunt mycroft and rightfully so 🙂‍↕️ {{URL}}",2024-04-28,8,prophesy,1784410170732278181
{{USERNAME}} Does encouragement make them more affordable?,2024-04-28,8,prophesy,1784410125031100721
"TRUE JUSTICE according  to the Holy Quran requires that if you have to give testimony against yourself  or our beloved ones you should do so”	-Hazrat Mirza Masroor Ahmad, Head of the Ahmadiyya Muslim Community	#StopWW3 #Islam #JammateAhmadiya",2024-04-28,8,prophesy,1784410100217856107
🙆😄🤱🦿	 comedy must testimony perceive charity desk,2024-04-28,8,prophesy,1784410024900690321
Hi I'm running {{USERNAME}}'s Goonscript!❤️		It's forced experience with some encouragement and suprises😘		#techdom #findom #virus #blackmail #infoplay #goon #anydesk #2dfd #hypno #clickslut #linkslut #accountplay		{{URL}},2024-04-28,8,prophesy,1784410016880926814
"{{USERNAME}} ✝️ 	Hear THE MOST HIGH GOD	with ""WALLS DOWN"" 😢		HE TRULY Loves HIS CREATION🫂		HOW BEAUTIFUL HIS openness is to ALL of us.		Feel HIS Pain &amp; Love ❤️ here		HE will gather us unto HIMSELF soon🚀		3AM FROM GOD'S ❤️ HEART: HIS SADNESS &amp; #RAPTURE ENCOURAGEMENT	{{URL}}",2024-04-28,8,prophesy,1784409982630236626
"“TRUE JUSTICE according to the Holy Quran requires that if you have to give testimony against   yourself or our beloved ones you   should do so”	-HazratMirzaMasroor Ahmad, Head of the Ahmadiyya Muslim   Community	#StopWW3",2024-04-28,8,prophesy,1784409968135061803
"{{USERNAME}} ⠀	⠀	first step), you can understand what was happening with the woman after the fire accident.		But this is an interpretation contexted with the game, it can have multiple readings for it.	⠀	⠀",2024-04-28,8,prophesy,1784409942738251930
{{USERNAME}} not a real photo.  an interpretation of data dippers,2024-04-28,8,prophesy,1784409861314535918
"Toby Fox is very much a ‘show, not tell’ kind of storyteller.		Nothing wrong with that, of course, but I wish he made more stuff absolute rather than up to interpretation. {{URL}}",2024-04-28,8,prophesy,1784409794238955971
{{USERNAME}} {{USERNAME}} {{USERNAME}} What's your interpretation of this paragraph {{URL}},2024-04-28,8,prophesy,1784409687070560550
"I just don't see the value of it. He doesn't require much interpretation, Balthasar just require extensive reading of his own texts to grasp so it's a waste of time to read even Schindler on him when you could be reading the GLT series instead.",2024-04-28,8,prophesy,1784409682980872254
"{{USERNAME}} Anything that has actual authority from Christ, meaning anything that isn’t Roman and anything that isn’t a loose interpretation of the Bible.",2024-04-28,8,prophesy,1784409584188141946
"{{USERNAME}} My interpretation is that China is being too nice to the US.  		My only hope is that it is a conscious strategy, as in, they are trying to ratchet up tensions, and that doesn't serve our interests, so let's not allow them to succeed.		There is a very good reason why US may want… {{URL}}",2024-04-28,8,prophesy,1784409555402719503
{{USERNAME}} {{USERNAME}} It wasnt even said by someone who works at jump comics. Its the editor of a company that licenses manga for distribution in France. He may be basing his comments on personal interpretation of the publicly available chapters or behind the scenes character details provided by Araki,2024-04-28,8,prophesy,1784409418269958181
"{{USERNAME}} {{USERNAME}} Interpreting what Albanese &amp; Dreyfus both said as deliberately divisive is an interpretation. Only incels, misogynists &amp; their female enablers are interpreting it as deliberately divisive.",2024-04-28,8,prophesy,1784409363563847874
"{{USERNAME}} {{USERNAME}} {{USERNAME}} ""Scalia issued the ruling in Heller quite some time ago. He was wrong too.""		So he was wrong and you're the metric by which it's measured. By all means, give us a class. A long thread, perhaps, on the correct interpretation of things. Please? {{URL}}",2024-04-28,8,prophesy,1784409241425727643
"{{USERNAME}} I don't think that's accurate. But if the ""highest bidder"" has the correct interpretation of the Constitution, it's a win.		I'd take a corrupt Clarence Thomas over a pure as the driven snow Sotomayor (they're probably both ""corrupt"" 🤣)",2024-04-28,8,prophesy,1784409232529403927
{{USERNAME}} I have the interpretation.,2024-04-28,8,prophesy,1784409194436710548
"{{USERNAME}} You did not do that, you re-wrote what they said to support your own false interpretation of the Second Amendment. 😉",2024-04-28,8,prophesy,1784409193480441865
"{{USERNAME}} {{USERNAME}} {{USERNAME}} {{USERNAME}} {{USERNAME}} It's important to note that an individual interpretation to the Servant is the majority view in scholarship. Baltzer holds the Servant to be a future individual and a second Moses, not a collective.		In a word, I agree the Servant = Israel, but I don't agree he's a collective.",2024-04-28,8,prophesy,1784409097225294030
"{{USERNAME}} there are times when genius’s annotations could give me an idea on what the song’s interpretation is, but overall i never really trusted genius",2024-04-28,8,prophesy,1784408972608577879
{{USERNAME}} {{USERNAME}} {{USERNAME}} Do you sincerely believe there are zero translation errors? Either by man’s interpretation of the meanings of the Bible or literal translators translating things incorrectly?? That’s a hot take bruv,2024-04-28,8,prophesy,1784408905323356247
"U have my fave interpretation of markjen on the worldddd. I was wondering if u ship them with any other dynamic? Like, coul… — THAAAANKS🥹 And YEAH totally I do I basically like everything hahaha and I don’t have preferences for D/S top/bottom dynamics… {{URL}}",2024-04-28,8,prophesy,1784408766173360623
"{{USERNAME}} My interpretation is that China is telling US that the world can be shared. That there is no need for one hegemon. It seems this joint declaration has gone unnoticed, and people are confused	{{URL}}",2024-04-28,8,prophesy,1784408702763585588
"{{USERNAME}} {{USERNAME}} I'm saying that the meaning being attributed to their statement is incorrect. ""No region will be more censored than another"" is a more accurate interpretation, and is why there's no case to be had.",2024-04-28,8,prophesy,1784408629829042370
"{{USERNAME}} {{USERNAME}} {{USERNAME}} You seem to be the one having difficulty considering your interpretation goes against the United States and various state constitutions, not to mention so many SCOTUS rulings.	Your “interpretations” are based on your personal beliefs rather than well established, documented, and… {{URL}}",2024-04-28,8,prophesy,1784408570974658954
"{{USERNAME}} Creation of Israel was based on the same methodology. “God said so” 		 Jews oppose this Zionistic interpretation		""Now go and smite Amalek, and utterly destroy all that they have, and spare them not; but slay both man and woman, infant and suckling, ox and sheep, camel and ass""",2024-04-28,8,prophesy,1784408510274715684
😶😐💗👨‍❤️‍💋‍👨💙	 result nor interpretation African-American,2024-04-28,8,prophesy,1784408471779033389
"{{USERNAME}} {{USERNAME}} {{USERNAME}} Which offence? Btw, I think you’ve got an overly liberal interpretation of party to offence re duty to prevent.",2024-04-28,8,prophesy,1784408410609373398
{{USERNAME}} 95% times it doesn’t work friend. People need motivation. Encouragement. Routine. Most people give up too fast. I would give up so many times when I started wouldn’t I have mentors. They helped me tremendously! Some are also super wealthy and still have groups they charge.,2024-04-28,8,prophesy,1784591706010124750
{{USERNAME}} {{USERNAME}} Trump won the first time?  Apparently you didn't listen to Pecker's testimony this week about his fraud schemes.,2024-04-28,8,prophesy,1784591670064926794
"Diego Rivera, an artist that incites controversy and thought—discuss your views on his interpretation of Mexico. #RiveraReactions",2024-04-28,8,prophesy,1784591666742976804
"{{USERNAME}} If she can’t offer expert testimony about a ‘64 Buick Skylark’s independent rear suspension, I’m not interested.",2024-04-28,8,prophesy,1784591657955893651
"Trump ‘Hush-Money’ Witness Admits to Inconsistencies in Testimony, FBI Report | The Epoch Times {{URL}}",2024-04-28,8,prophesy,1784591636384686544
"{{USERNAME}} No the whole religion interpretation are so off he was brutally killed by an no brainer of a Roman officer when his massage of love,  affection and caring became a symbol until the end of the time. His earthly body was sacrificed to embrace and embody his teachings of love and… {{URL}}",2024-04-28,8,prophesy,1784591624233718013
Captain Shem With Words Of Encouragement		Exhort BuildUp Commander Battle WordOfGod Militant JustinBieber Travis SundayMorning Ange Sulphur Tory NoTwitter PRECEPTUPONPRECEPT IUICNEWORLEANS {{URL}},2024-04-28,8,prophesy,1784591590603829465
The Testimony {{URL}} #deathexperience #God #Heaven #neardeathexperience #afterlife,2024-04-28,8,prophesy,1784591565228323318
"{{USERNAME}} Good morning, Godfather! Thank you so very much for your positive words of encouragement. God bless you. ❤️🇺🇸🇺🇸🇺🇸🇺🇸",2024-04-28,8,prophesy,1784591528196702274
{{USERNAME}} This is the writers interpretation of East.The Benins have no problem with Oduduwa. The argument we have is his origin. Which ife cannot identify since he was s stranger that came from the east to conquer ife. You have to answer the question. Can parents not pray for their child?,2024-04-28,8,prophesy,1784591477047529843
Compilation and interpretation of geochemical exploration maps {{URL}},2024-04-28,8,prophesy,1784591419832955294
{{USERNAME}} Correction: Nothing turns me off to religion more than the constant threats of death and destruction unless I follow the words or ‘interpretation’ of those words by a church. Just some pleasant thoughts for children and adults on a Sunday morning.,2024-04-28,8,prophesy,1784591329177026584
"Educational, scientific achievements in the work of the BJP government are special. Due to the encouragement of the BJP government, it is leading in the field of medicine!	#Amchya_Sunetra_Vahini_Khasdar {{URL}}",2024-04-28,8,prophesy,1784591328019419437
{{USERNAME}} {{USERNAME}} tennis fit testimony state motivation gifted,2024-04-28,8,prophesy,1784591319484317755
"2/	i wonder	if it’s beautiful,	if it’s a testimony	to something?  To someone?	In the midst of loss and abandonment	of everything by everyone I love and held	close and dear, I wonder if God abandons me, here? {{URL}}",2024-04-28,8,prophesy,1784591309975777752
Crazy how the interpretation of this image went from a bear protecting it's cub to sex with the smaller bear		To be clear NO gender affirmative medical care should be authorized until the person is 18 and can make those decisions for themselves. Period. {{URL}},2024-04-28,8,prophesy,1784591301243031849
