text,date,label,label_name,id
King Charles &amp; Friends Raped 'Hundreds of Children' - Explosive New Testimony {{URL}},2024-04-26,8,prophesy,1783688811857268817
{{USERNAME}} I’m not looking for articles. I’m looking for the direct testimony you cited. I’d like to read it for myself.,2024-04-26,8,prophesy,1783688794341798192
{{USERNAME}} expresses desire to be in the presence of {{USERNAME}} and offers encouragement!		He’s appeared to come around to supporting {{USERNAME}} and the	Great American Society Plan 🇺🇸 		Thank you for the support {{USERNAME}} !! {{URL}},2024-04-26,8,prophesy,1783688766260924632
☕️ Becky's Encouragement - Obedience To Christ		on yt @ beckyhaag	no copyright infringement intended		#beckyhaag #obedience #christisking #devotional #jesuscafe #vlogger {{URL}},2024-04-26,8,prophesy,1783688734845878688
Surviving the Shoah in the Dutch Countryside: A Child Survivor Gives Testimony {{URL}} #boulder,2024-04-26,8,prophesy,1783688594080858238
"Day 310 - 1 Kings 16	The chapter begins with Baasha, the king of Israel, who attracts divine judgment for his evil deeds, including his idolatry and the sins he led Israel into. God sends Jehu, the son of Hanani the seer, to prophesy the downfall of Baasha’s lineage, which...",2024-04-26,8,prophesy,1783688551110173039
{{USERNAME}} {{USERNAME}} {{USERNAME}} Unfortunately that voids all testimony,2024-04-26,8,prophesy,1783688543765967113
{{USERNAME}} {{USERNAME}} I’m thinking you don’t understand hearsay. What part of the testimony was hearsay?,2024-04-26,8,prophesy,1783688448190116087
{{USERNAME}} Is this a pre or post Ptolemaic prophesy? LOL!,2024-04-26,8,prophesy,1783688445052834195
{{USERNAME}} {{USERNAME}} His testimony is also irrelevant. He says nothing about the federal portion of the case. Everything pecker says is commonplace business and has nothing to do with campaign irregularity. It’s simply empty air. Bragg has no case.,2024-04-26,8,prophesy,1783688425066881079
"{{USERNAME}} {{USERNAME}} {{USERNAME}} Under oath:		""Epstein's longtime Palm Beach butler testified Ghislaine Maxwell gave him instructions to 'see nothing'		Underage Virginia Roberts aka Virginia Giuffre was at the island, Maxwell picked her up at Mar-a-Lago""		{{URL}}",2024-04-26,8,prophesy,1783688399112564934
"Someone was kind enough to post an aged “fact check” from 2021 and it prompted me to post this transcript of my testimony to the CDC from so long ago. Perma | Halt Covid Vaccine, Research Scientist Urges CDC {{URL}}",2024-04-26,8,prophesy,1783688334897754315
"Weekly Roundup on the Global Against #Antisemitism April 25, 2024		Source: Combat Antisemitism Movement		Following Columbia University President Minouche Shafik’s Congressional testimony, an explosion of antisemitic incidents occurred on American campuses, with Columbia at the… {{URL}}",2024-04-26,8,prophesy,1783688332196655484
{{USERNAME}} Thanks buddy! I appreciate that very much! My mom has been very sick and it’s here hard. Praying and hoping she gets well soon!  I appreciate your kind words and encouragement!,2024-04-26,8,prophesy,1783688214907171015
"{{USERNAME}} COVID-19 was a bio weapon.	Andrew Huff	Vice President of Eco health alliance.	Testimony under oath.		His boss, Peter dazak.	Created the Bioweapon known as COVID-19.		( {{URL}} )",2024-04-26,8,prophesy,1783688209400017100
{{USERNAME}} Amazing testimony &amp; im so very happy for everyone participating &amp; experiencing healing results!  Praise God. 		Early day tomorrow so shutting down. But thank you all for sharing.,2024-04-26,8,prophesy,1783688138826690704
"{{USERNAME}} {{USERNAME}} The way she cut her off and manipulated the testimony there, Why should she bend any rules for Omar’s kid if Omar is going to disrespect her like that?  So on with the process and out she goes.",2024-04-26,8,prophesy,1783688132959113305
{{USERNAME}} {{USERNAME}} Thomas is courtesy of Biden. He stopped corroborating witness testimony in the Anita Hill case .,2024-04-26,8,prophesy,1783688119235351021
"Many false prophets will arise and will mislead many. Because lawlessness is increased, most people’s love will grow cold. But the one who endures to the end, he will be saved. This gospel of the kingdom shall be preached in the whole world as a testimony to all the nations, and… {{URL}}",2024-04-26,8,prophesy,1783688086632669488
"{{USERNAME}} {{USERNAME}} Holy Mary, Mother of God 	Hail Holy Queen	Hail Mary Full Of Grace 	Queen of Heaven 	The Immaculate Conception 		""No, I am nothing but a creature, He (God) is everything"" - Mary 		Source: Roy Schoeman's conversion testimony {{URL}}",2024-04-26,8,prophesy,1783688082933371086
"{{USERNAME}} {{USERNAME}} {{USERNAME}} 	You may scratch it off after Karen's testimony, which you should be in court for. As a good wife should, to give loving spousal support &amp; hold a tiny hand while the horrors &amp; stories of him banging other hotter women during your marriage cums out.",2024-04-26,8,prophesy,1783687976192737652
#TIFI #RWA #LovelyWallet {{URL}} Thank you for always being a source of positivity and encouragement. {{USERNAME}} {{USERNAME}} {{USERNAME}},2024-04-26,8,prophesy,1783687967665475788
"{{USERNAME}} ✝️ 	Hear THE MOST HIGH GOD	with ""WALLS DOWN"" 😢		HE TRULY Loves HIS CREATION🫂		HOW BEAUTIFUL HIS openness is to ALL of us.		Feel HIS Pain &amp; Love ❤️ here		HE will gather us unto HIMSELF soon🚀		3AM FROM GOD'S ❤️ HEART: HIS SADNESS &amp; #RAPTURE ENCOURAGEMENT	{{URL}}",2024-04-26,8,prophesy,1783687932710162681
{{USERNAME}} {{USERNAME}} No damning testimony princess oh and fuck Ukraine,2024-04-26,8,prophesy,1783687869783060650
{{USERNAME}} Cant sue for a liars false testimony,2024-04-26,8,prophesy,1783687844961390746
{{USERNAME}} Awesome. Needed this encouragement. Thank you!,2024-04-26,8,prophesy,1783687803148046512
Judge Cannon Unseals Docs Alleging Jack Smith's Lead Prosecutor Threatened Trump Valet Attorney and Tried to Bribe Him in Exchange For Client's Testimony Against Trump | The Gateway Pundit | by Cristina Laila {{URL}},2024-04-26,8,prophesy,1783687700509335731
-There's a point where your life itself becomes a living testimony.		This all itself -		-A part of the looking glass -,2024-04-26,8,prophesy,1783687619169165763
Ania's Amazing Healing Testimony💪🏻		CTTO (Credits To The Rightful Owner)		Visit Us: {{URL}}		Learn More: {{URL}}		#BESTTA #Claybourn #Yong #Fashion #miracle #Godisreal #JesusChrist #Messiah #bible #salvation #truelove #gracefoundme #neverstop #fyp {{URL}},2024-04-26,8,prophesy,1783687590786580732
{{USERNAME}} Like your testimony on J6 committee?		Cry harder,2024-04-26,8,prophesy,1783687530639933532
"{{USERNAME}} Amen , my testimony is coming in Jesus name.",2024-04-26,8,prophesy,1783687500084465808
"{{USERNAME}} {{USERNAME}} I worked with Lauren Craig from {{USERNAME}} as my first mentor. Her encouragement to embrace what makes me different, instead of conforming to conventions, was fundamental to my writing.",2024-04-26,8,prophesy,1783687471425003613
"✝️ 	Hear THE MOST HIGH GOD	with ""WALLS DOWN"" 😢		HE TRULY Loves HIS CREATION🫂		HOW BEAUTIFUL HIS openness is to ALL of us.		Feel HIS Pain &amp; Love ❤️ here		HE will gather us unto HIMSELF soon🚀		3AM FROM GOD'S ❤️ HEART: HIS SADNESS &amp; #RAPTURE ENCOURAGEMENT	{{URL}}",2024-04-26,8,prophesy,1783687395482718262
"{{USERNAME}} No never say they got away with it, dont give them encouragement with these dumb posts,",2024-04-26,8,prophesy,1783687384640450791
Encouragement is through ignorance.		▬نمشؾ▬	◗W77◖		▬ٺون▬	◗FVF◖,2024-04-26,8,prophesy,1783687329359511728
"{{USERNAME}} {{USERNAME}} I was just thinking about this in the shower this morning in another case. A murder case with overwhelming evidence of guilt, but the DA fought like mad to get in ""exact match,"" ""100% sure"" firearms testimony that was already weak and tangential. They always get greedy.",2024-04-26,8,prophesy,1783687318341136663
😆🙃🥱☹️	 testimony satisfy supposed responsibility somehow model nevertheless,2024-04-26,8,prophesy,1783687201785778245
{{USERNAME}} I do I jus don’t be postin it 😂 to embarrassin unless it’s a testimony.,2024-04-26,8,prophesy,1783687167878762782
Who knew that Seller Amp had a variations section… thanks Kateecommerce for the help and encouragement tonight! {{URL}},2024-04-26,8,prophesy,1783687113113809364
{{USERNAME}} They don't want to recognize the fact that his scars and the way he looks is his testimony.,2024-04-26,8,prophesy,1783687105690104024
{{USERNAME}} It is so sad. It happened to my father's people. The Indigenous Chinook of Northwest Occupied America. But we have no promise of a saviour. Our elder's prophesy is that the land will take itself from the occupiers.,2024-04-26,8,prophesy,1783687089541792102
#TIFI #RWA #LovelyWallet {{URL}} Your words of encouragement have been a source of inspiration for me. {{USERNAME}} {{USERNAME}} {{USERNAME}},2024-04-26,8,prophesy,1783687057287922075
{{USERNAME}} {{USERNAME}} Fake story. Pure BS. Little to no details.   We know Israeli government make up a lot of stories to disinform &amp; coverup for their crimes. Similarly to Mia Schem's sea of lies testimony. {{USERNAME}} if you can believe such without questioning then you are completely oblivious.,2024-04-26,8,prophesy,1783687040644608435
{{URL}}	Lawyer James Kitchen presents his analysis on why the courts failed to uphold the individual’s rights and also to explain the capture of professional regulatory boards in the country. “I don’t care how many laws you have or how good they are on paper. They,2024-04-26,8,prophesy,1783686996256591935
Actually 	I am lucky that most of my followers are so funny and I always laugh and received encouragement when I see your comments 🤭,2024-04-26,8,prophesy,1783686892418224609
"I am a Libra. Have you heard about the ""Sabdwich Method"" -I start with a compliment or praise, then address the issue or area of improvement, and then end with another compliment or encouragement. That's what I do best at, always and unintentionally giving my opinion that way 🤘",2024-04-26,8,prophesy,1783686864383377415
"{{USERNAME}} {{USERNAME}} {{USERNAME}} I'd love to be in your presence right now...it's obvious you're in need of some ""encouragement""",2024-04-26,8,prophesy,1783686851448156558
"{{USERNAME}} I was hoping they at least would have given it back to Judge Chutkan, so that she could allow witness testimony, while they're deciding on the ruling.  Very disappointed, and worried actually.",2024-04-26,8,prophesy,1783686782049300723
{{USERNAME}} {{USERNAME}} {{USERNAME}} Heretic.  Jesus must according to prophesy come from the line of David from the Tribe of Judah.  If He is notJewish he is not the Messiah and Son of God.  Yer an eegit.,2024-04-26,8,prophesy,1783686777108091272
"{{USERNAME}} 4). The final decision must be based on whether a trans girl on puberty blockers who had not started Tanner Stage II male puberty has any unfair advantage over c*s girls. Also, expert testimony on both sides entered conflicting evidence of trans girl advantage before puberty.",2024-04-26,8,prophesy,1783686613626999004
"{{USERNAME}} Lost my husband 5 months ago and I feel like I read of me getting stronger I am getting more broken. We all feel your pain, I wish I had encouragement words for you and everyone going through this very painful life experience.",2024-04-26,8,prophesy,1783686506961367494
BOOM! Judge Cannon Unseals Docs Alleging Jack Smith's Lead Prosecutor Threatened Trump Valet Attorney and Tried to Bribe Him in Exchange For Client's Testimony Against Trump {{URL}} #gatewaypundit via {{USERNAME}} {{URL}},2024-04-26,8,prophesy,1783686504230838523
{{USERNAME}} Thank you for the encouragement 🙂♥️ it means a lot.,2024-04-26,8,prophesy,1783686447792349561
Testimony resumes in hush money case		Former US President #DonaldTrump faces Supreme Court's immunity test as 'hush money' trial continues 		{{USERNAME}} joined by {{USERNAME}} bring you this report 		Watch more on {{URL}} {{URL}},2024-04-26,8,prophesy,1783686301138686228
"{{USERNAME}} {{USERNAME}} Except the explicit testimony of both witnesses is that this was to protect his campaign and the timing lines up with this. When you say ""to protect his privacy"" it's just a charitable guess that doesn't line up with the evidence or even just common sense.",2024-04-26,8,prophesy,1783686223304761758
"Huhhh, Sulking on me 	Give me encouragement, rather than mujhpe gussa hone ke 😅🫂 {{URL}}",2024-04-26,8,prophesy,1783686194615955594
Judge Cannon Unseals Docs Alleging Jack Smith's Lead Prosecutor Threatened Trump Valet Attorney and Tried to Bribe Him in Exchange For Client's Testimony Against Trump {{URL}} #gatewaypundit via {{USERNAME}},2024-04-26,8,prophesy,1783686192195949003
"A judge has denied #Trump’s request for a new trial or change of verdict in the #EJeanCarroll case, rejecting the Trump’s contention that the outcome was tainted by “extreme” restrictions on his courtroom testimony and erroneous instructions to the jury.	 {{URL}}",2024-04-26,8,prophesy,1783686187720343616
"{{USERNAME}} {{USERNAME}} {{USERNAME}} Sussman was acquitted of materially lying to the FBI about working for Clinton.  Testimony established that he brought the hoax to the FBI for Clinton, and the info he brought was false, but he was not charged with that.  The FBI knew who he worked for.",2024-04-26,8,prophesy,1783686175510729061
#Orange #TestNet #blockchain {{URL}} Thank you for always being a source of positivity and encouragement. {{USERNAME}} {{USERNAME}} {{USERNAME}},2024-04-26,8,prophesy,1783686153905778937
{{USERNAME}} Thanks for the encouragement &amp; support.,2024-04-26,8,prophesy,1783686112537460950
#TIFI #RWA #LovelyWallet {{URL}} Thank you for always being a source of positivity and encouragement. {{USERNAME}} {{USERNAME}} {{USERNAME}},2024-04-26,8,prophesy,1783686075208151094
#Orange #Zealy #Join {{URL}} Thank you for always being a source of positivity and encouragement. {{USERNAME}} {{USERNAME}} {{USERNAME}},2024-04-26,8,prophesy,1783686069554147462
{{USERNAME}} His encouragement was the best thing fuq u liberals,2024-04-26,8,prophesy,1783686030274494899
"{{USERNAME}} Anybody who’s EVER said Cassandra and shown they know her existence, typed “ended Cassandra”, or “the worst thing about the fandom isn’t the racism and ableism, no, it’s Cassandra”…		They are saying they ARE aware of Cassandra’s prophesy, yet still chose hate over proper action.",2024-04-26,8,prophesy,1783685981771649185
George Conway: Trump trial first witness’s testimony is 'damning' and could land ex-president in jail {{URL}} {{URL}},2024-04-26,8,prophesy,1783685944014463461
"JUSTICE failed with all of these check &amp; balances	LOOK at how immunity reaches the acts of public officials, trial attorneys who knowingly conspire when presenting false testimony in an sex allegation to grand jurors to indict using objective evidence like DNA persuade to convict {{URL}}",2024-04-26,8,prophesy,1783685936502481406
Much of the Supreme Court  testimony today was about loyalty,2024-04-26,8,prophesy,1783685919939215718
{{USERNAME}} {{USERNAME}} This is not meerly lok sabha poll but a testimony that all of us ( indians) have dignity and wont run after bheek ka paisa.,2024-04-26,8,prophesy,1783685767908467108
"23:32 states that ""I am against those who prophesy false dreams and retell them to lead My people astray with their reckless lies""2. Luke 23:32 mentions that ""there were also two other, malefactors, led with him to be put to death""3.",2024-04-26,8,prophesy,1783685756189356534
"{{USERNAME}} In your entire testimony excerpt, only this line is legal: ""Immediately after the attacks on October 7th, an MIT-funded anti-Israel student group said that the Massacre was justified as an act of resistance."" The ENTIRE rest is illegal &amp; NOT protected speech.",2024-04-26,8,prophesy,1783685666921934877
"{{USERNAME}} {{USERNAME}} I am incredibly grateful for the opportunity to share my testimony and express my heartfelt appreciation to Mrs {{USERNAME}} Her platform has been an absolute blessing in my life, and I cannot emphasize enough how helpful and trustworthy she is.",2024-04-26,8,prophesy,1783685472901812589
"{{USERNAME}} I am incredibly grateful for the opportunity to share my testimony and express my heartfelt appreciation to Mrs {{USERNAME}} Her platform has been an absolute blessing in my life, and I cannot emphasize enough how helpful and trustworthy she is.",2024-04-26,8,prophesy,1783685456770527471
"{{USERNAME}} I am incredibly grateful for the opportunity to share my testimony and express my heartfelt appreciation to Mrs {{USERNAME}} Her platform has been an absolute blessing in my life, and I cannot emphasize enough how helpful and trustworthy she is.",2024-04-26,8,prophesy,1783685441905950937
"Blessings, Money, Testimony 🙏🏽",2024-04-26,8,prophesy,1783685434511425577
"{{USERNAME}} {{USERNAME}} I am incredibly grateful for the opportunity to share my testimony and express my heartfelt appreciation to Mrs {{USERNAME}} Her platform has been an absolute blessing in my life, and I cannot emphasize enough how helpful and trustworthy she is.",2024-04-26,8,prophesy,1783685421014073497
{{USERNAME}} Yes! I have testimony to that.,2024-04-26,8,prophesy,1783685383512879505
"{{USERNAME}} Good morning sir and we thank God for your testimony. Please sir, help me with 1k to transport myself to work. I don't know how l will get to work this morning and it's giving me sleepless night. This is 3.30am Nigerian time and my eyes are really heavy, but can't sleep.",2024-04-26,8,prophesy,1783685379658224054
"A question I have is that I know David Pecker has immunity in exchange to his testimony... However, does that immunity extend to the National Enquirer itself? It seems the National Enquirer would be open to all sorts of legal jeopardy now because of Pecker's testimony.",2024-04-26,8,prophesy,1783685360599413051
"{{USERNAME}} I am incredibly grateful for the opportunity to share my testimony and express my heartfelt appreciation to Mrs {{USERNAME}} Her platform has been an absolute blessing in my life, and I cannot emphasize enough how helpful and trustworthy she is.",2024-04-26,8,prophesy,1783685355201310948
{{USERNAME}} thank you so much! The encouragement is definitely needed and appreciated 🫶🏻,2024-04-26,8,prophesy,1783685329536381128
"{{USERNAME}} I am incredibly grateful for the opportunity to share my testimony and express my heartfelt appreciation to Mrs {{USERNAME}} Her platform has been an absolute blessing in my life, and I cannot emphasize enough how helpful and trustworthy she is.",2024-04-26,8,prophesy,1783685328286413006
"Honestly, the Lakers crowd can be pretty rough on Anthony Davis. Tonight? I just hear encouragement and support. Even from fans, it's an all-hands-on-deck approach to beating the Nuggets.",2024-04-26,8,prophesy,1783685323832295750
{{USERNAME}} My conspiracy hat is on. So Trump is not worried about Pecker testimony because; they have an agreement that he will say things in cross that will undermine his prosecution testimony. He gets the deal and gives Trump the reasonable doubt. 🤔🤔,2024-04-26,8,prophesy,1783685321638780994
"{{USERNAME}} I am incredibly grateful for the opportunity to share my testimony and express my heartfelt appreciation to Mrs {{USERNAME}} Her platform has been an absolute blessing in my life, and I cannot emphasize enough how helpful and trustworthy she is.",2024-04-26,8,prophesy,1783685296820822328
"{{USERNAME}} {{USERNAME}} I am incredibly grateful for the opportunity to share my testimony and express my heartfelt appreciation to Mrs {{USERNAME}} Her platform has been an absolute blessing in my life, and I cannot emphasize enough how helpful and trustworthy she is.",2024-04-26,8,prophesy,1783685253699084590
"{{USERNAME}} {{USERNAME}} I am incredibly grateful for the opportunity to share my testimony and express my heartfelt appreciation to Mrs {{USERNAME}} Her platform has been an absolute blessing in my life, and I cannot emphasize enough how helpful and trustworthy she is.",2024-04-26,8,prophesy,1783685216197878078
"{{USERNAME}} I am incredibly grateful for the opportunity to share my testimony and express my heartfelt appreciation to Mrs {{USERNAME}} Her platform has been an absolute blessing in my life, and I cannot emphasize enough how helpful and trustworthy she is.",2024-04-26,8,prophesy,1783685182060470431
Tabloid publisher says he pledged to be Trump campaign’s ‘eyes and ears’ during 2016 race   {{URL}},2024-04-26,8,prophesy,1783685181129306251
"{{USERNAME}} {{USERNAME}} {{USERNAME}} Right, the government needs to prove Trump’s intent, that some of these actions were intended to benefit his electoral prospects. Pecker’s testimony seems to go a long way in establishing that. Cohen is obviously going to testify to that effect as well. We’ll see.",2024-04-26,8,prophesy,1783685150334955696
"{{USERNAME}} I am incredibly grateful for the opportunity to share my testimony and express my heartfelt appreciation to Mrs {{USERNAME}} Her platform has been an absolute blessing in my life, and I cannot emphasize enough how helpful and trustworthy she is.",2024-04-26,8,prophesy,1783685123499589816
"{{USERNAME}} I am incredibly grateful for the opportunity to share my testimony and express my heartfelt appreciation to Mrs {{USERNAME}} Her platform has been an absolute blessing in my life, and I cannot emphasize enough how helpful and trustworthy she is.",2024-04-26,8,prophesy,1783685087004946899
"{{USERNAME}} I am incredibly grateful for the opportunity to share my testimony and express my heartfelt appreciation to Mrs {{USERNAME}} Her platform has been an absolute blessing in my life, and I cannot emphasize enough how helpful and trustworthy she is.",2024-04-26,8,prophesy,1783685065253294101
"{{USERNAME}} {{USERNAME}} I am incredibly grateful for the opportunity to share my testimony and express my heartfelt appreciation to Mrs {{USERNAME}} Her platform has been an absolute blessing in my life, and I cannot emphasize enough how helpful and trustworthy she is.",2024-04-26,8,prophesy,1783685033472950300
"Guys are any oomfs here male vas I am in dire need of some more for final testimony, I’ve got a billion female auditions but little to no male ones",2024-04-26,8,prophesy,1783685029711032428
"{{USERNAME}} I am incredibly grateful for the opportunity to share my testimony and express my heartfelt appreciation to Mrs {{USERNAME}} Her platform has been an absolute blessing in my life, and I cannot emphasize enough how helpful and trustworthy she is.",2024-04-26,8,prophesy,1783684998379233515
"{{USERNAME}} {{USERNAME}} His team didn't need her testimony. She had lawyers and was willing to testify. Her testimony was then not on the record, but she still came out DURING THE TRIAL and the 2022 trial to speak highly of him. Quit. Reaching.",2024-04-26,8,prophesy,1783684969602122214
{{USERNAME}} {{USERNAME}} {{USERNAME}} {{USERNAME}} {{USERNAME}} {{USERNAME}} {{USERNAME}} {{USERNAME}} {{USERNAME}} {{USERNAME}} Not by me I TOTALLY saw it as ENCOURAGEMENT!!!	And I shall take ANY and ALL!!!!,2024-04-26,8,prophesy,1783684937184419941
Streams in the Desert airs weeknights at 11:30pm (ET/PT).  This devotional program brings comfort and encouragement to those who face difficult times. {{URL}},2024-04-26,8,prophesy,1783684926032019604
"{{USERNAME}} {{USERNAME}} I am incredibly grateful for the opportunity to share my testimony and express my heartfelt appreciation to Mrs {{USERNAME}} Her platform has been an absolute blessing in my life, and I cannot emphasize enough how helpful and trustworthy she is.",2024-04-26,8,prophesy,1783684869710606339
{{USERNAME}} {{USERNAME}} A testimony is supposed to be based. (To use a recent colloquialism typically associated with the far right bros),2024-04-26,8,prophesy,1783697641311977967
👺👭🙇‍♂️💯👹	 plus teaspoon intensity coalition testimony seriously,2024-04-26,8,prophesy,1783697531404218712
I’m watching bible study on live and Bishop used {{USERNAME}} as a testimony to when you show up you blow up!!!,2024-04-26,8,prophesy,1783697510340391101
Truly grateful &amp; humbled 🙏🏻 Dedicated to my teachers🙏🏻This one’s for Mom &amp; Dad &amp; all who believed in me in times even I didn’t! Thanks {{USERNAME}} for opportunity! Thanks  {{USERNAME}} {{USERNAME}}  for encouragement!  #NeurologyProud #grateful {{URL}},2024-04-26,8,prophesy,1783697500207276078
"{{USERNAME}} {{USERNAME}} Does that change the fact he is their star witness?  Did you just embarass yourself by not reading my tweet? Did I say that was his testimony? Also, why are you purposely lying about his testimony then? Is it something all never Trumpers do?",2024-04-26,8,prophesy,1783697440693952820
"&lt;Pecker's arrangement with Trump's campaign has been called a ""fake news"" mill, but his testimony suggests something much more...		{{URL}}",2024-04-26,8,prophesy,1783697405994570075
"If you'd like to know how devastating a witness David Pecker is. If you want to know how devastating Pecker's testimony is, hear donnie-boy berate him. Pecker, a long-time friend who respects trump, is truthfully testifying with no age to grind. To the jury, this testimony is key",2024-04-26,8,prophesy,1783697400705778126
{{USERNAME}} “His testimony was breathtaking.”		Who says that?,2024-04-26,8,prophesy,1783697389993209988
"{{USERNAME}} {{USERNAME}} {{USERNAME}} {{USERNAME}} Lady, I have given you example.After example, the call alone to Georgia is a criminal {{URL}} don't get to do {{URL}} not a presidential act and it's not right... Packer and there will be others to back up his testimony because trump is guilty",2024-04-26,8,prophesy,1783697354492633302
